id,author,body,subreddit,created_utc,score,parent_id,link_id,controversiality,openness,conscientiousness,extraversion,agreeableness,neuroticism
h04xyd7,Wwe_minecraft,R.I.P takes sreak,BrandonDE,1622505604,2,t3_npeg68,t3_npeg68,0,0.4491533935070038,0.5371547341346741,0.5016149878501892,0.45110705494880676,0.4295468330383301
h04xyd8,Skurgelock,I feel like i need to watch the banana video. I didnt come this far. Someone comment link,Superstonk,1622505604,1,t3_nopyos,t3_nopyos,0,0.4336790442466736,0.5382022261619568,0.5072180032730103,0.44963374733924866,0.41965433955192566
h04xyd9,Zoemaestra,I may be in Birmingham in that time - can I get a jab while passing through or do I need to live there?,CoronavirusUK,1622505604,1,t3_np5rdu,t3_np5rdu,0,0.43971627950668335,0.5362085700035095,0.5000933408737183,0.4435593783855438,0.42826607823371887
h04xyda,ipoonekkid,I saw them litter.,AskReddit,1622505604,1,t3_np8qx3,t3_np8qx3,0,0.43045711517333984,0.5436269044876099,0.508672297000885,0.44881004095077515,0.42950573563575745
h04xydb,jeffmc81,Mine can't catch for shit either,dogoargentino,1622505604,4,t3_npdft3,t3_npdft3,0,0.4415322542190552,0.5363650321960449,0.498127281665802,0.44566184282302856,0.42533111572265625
h04xydd,SPANH0BG0BLIN1,"wait a minute... they wanted to dock nurses wages 4% AND ask them to pay back 20 000$ from the past 4 years?

Jesus christ. FUCK the PCs and this government.",Winnipeg,1622505604,18,t1_h03tvtz,t3_np43f7,0,0.43618568778038025,0.5385159254074097,0.5014455914497375,0.44163957238197327,0.43313202261924744
h04xyde,NorCalGeologist,Is this on the San Carlos Rez? Got to work out there for a few months and talk about God’s country. And I’m an agnostic.,overlanding,1622505604,1,t3_noiol0,t3_noiol0,0,0.4294748604297638,0.5415874719619751,0.505423903465271,0.4354761242866516,0.42528674006462097
h04xydf,goodbyeCapo,I can't pin down the damn theme. I know there is one... Just what though..,Shitty_Car_Mods,1622505604,1,t3_np2yvf,t3_np2yvf,0,0.4319993257522583,0.5399178266525269,0.4976743161678314,0.4433836340904236,0.4238376021385193
h04xydh,Dionogah734,"Easy one: souls. They see an undefended plane FILLED with souls, they swarm like flies to honey.

Bit spicier: demons. Devils may have a lust for souls and power, but an even greater hatred of demons. Say the demons got there first. Now the devils invade just to expel the demons (and get some sweet sweet mortal souls too while they're at it).

Even spicier: Nine Hells intrigue. Perhaps one archdevil, let's say Levistus, has stationed his forces on this plane to steadily corrupt mortals, and perhaps was a big player in the gods abandoning the realm. Levistus has a rival, named Geryon. Perhaps Geryon musters his forces to route the forces of Levistus, to spite his rival but also to claim the same undefended and precious resource Levistus got unfettered access to: souls.",DMAcademy,1622505604,1,t3_nonqyf,t3_nonqyf,0,0.43266698718070984,0.5446332693099976,0.5046219229698181,0.4426455795764923,0.43234705924987793
h04xydi,juanless,Because a lot of young men need an avatar for their insecurities.,hockey,1622505604,2,t1_h04xqu2,t3_npf4g8,0,0.43161386251449585,0.5360851287841797,0.5049313306808472,0.4435870051383972,0.4266042709350586
h04xydj,BilesMldwest,Your exactly what I’ve been   👀 for,CuteLittleButts,1622505604,1,t3_npbsx7,t3_npbsx7,0,0.441785603761673,0.540442943572998,0.5064159631729126,0.4437164068222046,0.4254256784915924
h04xydk,babyllamadrama35,Wait but she’s never actually made it like this? Lmao does this dumb bitch know she’s made coffee before and she’s just put it straight into her ✨mama✨ cup? Looks like someone’s been on tik tok and seen other videos and (I know this next part is crazy when it’s referencing Ali) and is now copying and claiming it to be her own 🙌🏻recipe🙌🏻,AliandJohnJames,1622505604,7,t3_npe98f,t3_npe98f,0,0.44115108251571655,0.5388888716697693,0.5108136534690857,0.4430634379386902,0.42837223410606384
h04xydl,NoRelationship1157,Sorry Lena that last one  should of  said you are a sexy babe LOL👍😎,milf,1622505604,2,t1_h04xs7c,t3_npdy5c,0,0.4484989047050476,0.5375592112541199,0.5044394135475159,0.44581422209739685,0.4281776547431946
h04xydm,king_zacarias,"That’s not the best debut but he didn’t get shelled

He made some bad pitches but also made some good pitches. He also didn’t have control issues.

I would feel comfortable bringing him up to start against some bad teams like the Tigers and Orioles. Also in the bullpen if we need him there

He looked better than Stiever’s 2021 debut. That was just a disaster",whitesox,1622505604,7,t3_npeozo,t3_npeozo,0,0.4402751922607422,0.5313645005226135,0.5025053024291992,0.44434651732444763,0.4277373254299164
h04xydn,deadair3210,"Nah, it's not hard lol, you can either add the specific time to the end of the link or just use the checkbox in the share prompt on desktop",BrandNewSentence,1622505604,19,t1_h04x7zx,t3_npbq8w,0,0.4426504373550415,0.5337802171707153,0.5033061504364014,0.4450494050979614,0.42576250433921814
h04xydp,bekindalways23,I hope that’s accurate!,firstimpression,1622505604,1,t1_h04xvlt,t3_npgbdn,0,0.4378374218940735,0.537470817565918,0.506557822227478,0.4407329261302948,0.4230675995349884
h04xydq,PanachelessNihilist,"Given the Islanders cap crunch, Lou needs to either convince Ladd to LTIR or pay Seattle whatever they ask for to take him in the expansion draft. Losing Beau, Pelech, or Sorokin simply cannot happen, and the comedown from this window is going to hurt either way.  There's simply not enough room (and you're not getting a top-5 draft pick) to add elite talent, so you have to try and keep the core together as long as possible.

Man, this is where Lou's hideous contracts for Leo and Greene just absolutely kill the Islanders. That's $5 million against next year's cap for both of them. An absolute tire fire.",NewYorkIslanders,1622505604,4,t3_npf4eh,t3_npf4eh,1,0.44471031427383423,0.5333786606788635,0.5041533708572388,0.44487810134887695,0.42938631772994995
h04xydt,monty2bk,Buy Tractor 🚜,TeslaModelY,1622505604,1,t3_noors6,t3_noors6,0,0.44268089532852173,0.5361389517784119,0.503809928894043,0.45010337233543396,0.42652297019958496
h04xydu,Kabouki,"This is exactly how you deal with abusive employers. You get their buyers to put pressure on em. 

There is a happy middle where athletes don't get treated like shit and athletes not showing up. 

The fact that we are seeing more of this means that it's been a behind the scenes issue for some time now.",news,1622505604,6,t1_h04itjo,t3_np9m8k,0,0.4391472637653351,0.5383036136627197,0.5118095278739929,0.43933311104774475,0.427711546421051
h04xydv,broke-collegekid,Goddamn that was hot,sixers,1622505604,12,t3_npeihe,t3_npeihe,0,0.4417564570903778,0.5346292853355408,0.4996756613254547,0.44950029253959656,0.4264248013496399
h04xydy,dodgyasfuck,Why on earth has this been removed?,nrl,1622505604,2,t3_npdijh,t3_npdijh,0,0.4414551258087158,0.539324164390564,0.4991432726383209,0.4433012008666992,0.4252643883228302
h04xye0,lmakorean,"Pic was taken a little premature, kickin myself for forgetting to get one after we torqued them and bonded",Lineman,1622505604,4,t1_h04xjmx,t3_npgj6m,0,0.4378182888031006,0.535138726234436,0.5015947818756104,0.4493456184864044,0.4294336140155792
h04xye1,thatwasntababyruth,I sometimes wonder if Geralt's tendency towards sorceresses is in part to avoid too many Eskimo brother situations with Dandelion.,witcher,1622505604,11,t1_h04nauo,t3_np6inb,0,0.42977187037467957,0.5409024357795715,0.5024567246437073,0.44764167070388794,0.4273654520511627
h04xye2,Replybot5000,If YOU BOUGHT UNDER 500K PER SHARE...WE ARE COMING FOR YOU.,amcstock,1622505604,13,t3_npezar,t3_npezar,0,0.44076773524284363,0.5396459698677063,0.5074626207351685,0.4473496675491333,0.42464718222618103
h04xye3,opulent1986,+1 for primobolan. Stuff really works…. Too well for me sometimes - I’ve had it crash my e2 before.,Testosterone,1622505604,1,t1_h03ya6i,t3_np90w2,0,0.4340207576751709,0.5415101647377014,0.5083563923835754,0.44335228204727173,0.421675443649292
h04xye4,Hoodnight,Mine came from [this lot](https://www.urbangent.com.au/product/urban-olive-green-nato-strap/).,Watches,1622505604,1,t1_h0358vh,t3_noz4k8,0,0.43867841362953186,0.5403022766113281,0.505927324295044,0.44611623883247375,0.4370265305042267
h04xye5,ProfessionalCoat8011,"Pasted from a brother from our Telegram:

SAFERmoon is currently one of the most undervalued projects out there. It's the SAFER and actually useful alternative to meme-only tokens. Audited by BSC Gemz, the most trusted community on the Binance Smart Chain. Unruggable, with a transparent development and moderating team that actually cares and engages with the community on a daily basis, while keep building. 

The goal is to create a SAFER BSC ecosystem overall, which becomes more and more important with each passing day that brings new rugs &amp; flash loan attacks. Through the soon-launching SAFERpad that deploys battle-tested code only, not only can investors of new tokens rely on safety but it also creates even more utility for SAFERmoon holders.",SatoshiStreetBets,1622505604,10,t3_npeq8a,t3_npeq8a,0,0.4336252212524414,0.5365272164344788,0.510292649269104,0.44294053316116333,0.43211469054222107
h04xye7,Starshapedsand,Story is getting told in earlier comments above,interestingasfuck,1622505604,2,t1_h0468u5,t3_np58zc,0,0.44089454412460327,0.5373743176460266,0.49957752227783203,0.4473557770252228,0.4248349666595459
h04xye8,spamguzzler,I have some after sun cream!,BigBoobsGW,1622505604,2,t3_nn8t6c,t3_nn8t6c,0,0.4386572241783142,0.5403510332107544,0.502003014087677,0.4436049163341522,0.42462968826293945
h04xyea,Ancient_Fall,Pizza pringles,de_IAmA,1622505604,5,t1_h04xt62,t3_npcxk1,0,0.43992501497268677,0.5402407646179199,0.4981592893600464,0.44908636808395386,0.4278799295425415
h04xyec,CitroBeer,You should go to prison for *not* burning the Canadian flag.,neoconNWO,1622505604,25,t1_h04xlz4,t3_nosxvs,0,0.433411568403244,0.540510892868042,0.5025490522384644,0.43787556886672974,0.4258350133895874
h04xyed,BadAssThrowaway101,Only reason he has confidence is because ignorance is bliss. How tf did he write that sign backwards?,RoastMe,1622505604,1,t3_noo8dc,t3_noo8dc,0,0.44184961915016174,0.5404930114746094,0.5006489753723145,0.4432150423526764,0.42856571078300476
h04xyee,skztr,"Those who tip must accept their culpability in a system of exploitation.

Tipping conversations often involve comparisons of tipped income to *minimum wage*. Think about that: they're so exploited that they can't imagine their worth to be more than the absolute minimum allowed under the law, so tips are seen as a nice bonus, rather than what they actually are: barely making ends meet by begging despite providing a valuable service.",WhitePeopleTwitter,1622505604,5,t1_h04ns58,t3_npavr0,0,0.4303869903087616,0.5409879088401794,0.5042413473129272,0.44052913784980774,0.4262709319591522
h04xyeg,piolintheboss,"If you can't feel the emotion in adonis' painting, you're not a real arteest",WestSubEver,1622505604,1,t3_np9eow,t3_np9eow,0,0.4445872902870178,0.5376610159873962,0.49874502420425415,0.4500543475151062,0.4270031154155731
h04xyeh,Pea-Asleep,koil66 you r super smelly and your nose is crooked (:&lt;,RPClipsGTA,1622505604,1,t3_nmu0c6,t3_nmu0c6,0,0.4446074664592743,0.5331902503967285,0.501975953578949,0.44795578718185425,0.4287779629230499
h04xyei,deceivingleek2,Just wanted to let you know I laughed out loud for real.,UnearthedArcana,1622505604,1,t1_h03y0vm,t3_np2pnw,0,0.4326735734939575,0.5392085909843445,0.5040917992591858,0.4489026963710785,0.42527565360069275
h04xyej,Foxtrotmike556,Wow thank you I want more beautiful ebony bodies like yours your boobs are beautiful,PreggoPorn,1622505604,2,t3_npgnn2,t3_npgnn2,0,0.43787258863449097,0.5360994935035706,0.5019546151161194,0.45025500655174255,0.42832881212234497
h04xyek,Emotional-Check-9290,"That’s what I intend on doing, cross slats all around, a concrete slab in the middle of the pallet and to screw the coop into them. Still a bit of work to do yet.",chickens,1622505604,15,t1_h04wzlr,t3_npggu5,0,0.43067294359207153,0.5429644584655762,0.5046928524971008,0.4436190724372864,0.4291451871395111
h04xyel,Quirky-Weakness-5208,Manden Priv por Reddit y les paso su Instagram de la Daniela,mexicanas_ardientes,1622505604,1,t3_npgtvx,t3_npgtvx,0,0.44058170914649963,0.5364125370979309,0.5007181763648987,0.44764119386672974,0.42581668496131897
h04xyem,Jeremy-132,It was probably meant to be run in Taric decks where it would get buffed by both Taric and the array of Targon cards,LegendsOfRuneterra,1622505604,1,t3_np63ek,t3_np63ek,0,0.4418447017669678,0.5362961888313293,0.503449022769928,0.446226567029953,0.42580646276474
h04xyeo,NotANaziOrCommie,"It's really not though. Quite depressing really, It has nothing to do with the fortnite. Rather the fact that he has to stream anything for 10+ hours a day doing this to pay for his father's treatment. Anything you wind up having to do for 10+ hours a day is going to kill any enjoyment you ever had doing it. 

Look at his face. He's not enjoying it, its just probably the thing he hates the least when he has to do it 10+hrs/day.",Cringetopia,1622505604,2,t1_h03844f,t3_np4cuk,0,0.4395351707935333,0.5394556522369385,0.5115182399749756,0.4470336437225342,0.4220169484615326
h04xyep,DIOsexual_priest,"Malik: the only virgin here is you, you misguided suicidal.",dankmemes,1622505604,1,t3_np5rq8,t3_np5rq8,0,0.4300330877304077,0.5452077984809875,0.5087059140205383,0.4412505626678467,0.42268264293670654
h04xyer,exponant,"# OP is very likely a repost bot  

These bots steal content and repost it to build karma. For example, this post is stolen from [this original post](/r/HellsCube/comments/guaxcc/obligatory_1g_mana_dork/).
  
The accounts are often resold and are used to spam, scam, or for other nefarious purposes.

If you check OP's profile, you will likely see many posts and comments based on past popular contributions from authentic Redditors, but the OP is not invested in these communities and they will only regurgitate content as long as it takes to build up enough karma to make money.

Please [report these accounts to the admins](https://reddit.com/report), to moderators, and do not upvote reposts like this one.

[I am a bot, but please send me feedback if I make a mistake and my owner will review it.](https://www.reddit.com/message/compose/?to=exponant)",HellsCube,1622505604,10,t3_npgl9e,t3_npgl9e,0,0.43925079703330994,0.5372111797332764,0.509960412979126,0.44275999069213867,0.43233659863471985
h04xyes,O_W_Liv,"So my kid has ________disease/disorder we tried treating as a child and it never  worked instead of making sure she's in facility having her basic needs met for the rest of her life she's on her own.

Some people can not cope with basics like daily hygiene and bill paying.  If the diagnosis was cancer, cerebral palsy, anything else and the adult child wasn't capable of taking care of themselves we would be outraged.

21 years ago they had a child and if that child may never be able to live independently.  I don't care why.",AmItheAsshole,1622505605,33,t1_h04w1r0,t3_npblj8,0,0.4342992901802063,0.538041353225708,0.5134007334709167,0.43677473068237305,0.4374949634075165
h04xyet,ArchaicWolf101,"I like the sound of the modifiers. I'll have a look into them.

Thank you very much, I could have missed out on this little gem.

Cheers.",VRGaming,1622505605,2,t1_h03efh1,t3_nnv3rq,0,0.4363255500793457,0.5392613410949707,0.5045880079269409,0.44884663820266724,0.42212268710136414
h04xyeu,dontblinkdalek,Fuck. I knew that too. Totally didn’t think about that. Damn. I guess I was just thinking that it was awesome that his witty one-liner was heard by so many people.,AskReddit,1622505605,5,t1_h04q8pk,t3_np30w2,0,0.43471232056617737,0.5315828919410706,0.5058234333992004,0.4510279893875122,0.4257334768772125
h04xyev,PixelBlock,Maybe the problem is more people should talk like Mike Rowe does about jobs,stupidpol,1622505605,21,t1_h04p0yt,t3_np8fnh,0,0.44092124700546265,0.5405531525611877,0.504362165927887,0.4442463219165802,0.4264795482158661
h04xyex,lillylovinit,"I think u likeely dont know wtf your talking about.   I havent been dishonest about any part of my application.   

Also you may wanna check your internet conne-",TargetedEIDL,1622505605,1,t3_nosfvp,t3_nosfvp,0,0.4416953921318054,0.5387043952941895,0.5054727792739868,0.4440970718860626,0.4236011207103729
h04xyez,bilbo_the_innkeeper,"At the risk of getting roasted for self-promotion, I cohost The Sandersonian Institute of Cosmere Studies, if you’re looking for another... :)",brandonsanderson,1622505605,2,t1_h03z9w2,t3_np6da9,0,0.43883657455444336,0.5380308628082275,0.5053737759590149,0.44378429651260376,0.42791301012039185
h04xyf0,rnawaychd,"He's stormed out to allow time to delete, all of which will be re-added after he shows her there's now nothing there.",AsOneAfterInfidelity,1622505605,32,t1_h04uala,t3_npfkmo,0,0.4445761740207672,0.5358771681785583,0.5071862936019897,0.4447743594646454,0.42472150921821594
h04xyf1,DB-Institute,"If you go in and die first but get immediately traded that’s makes you negative, but you still did your job. Mark may have been negative, but he was never afraid to get in that bitch, which is something a lot of entry fraggers don’t have.",R6ProLeague,1622505605,3,t1_h04mvn7,t3_np7d1c,0,0.436359703540802,0.5354222655296326,0.5053384304046631,0.44200655817985535,0.4234541952610016
h04xyf2,herbibot,"beep. ima [bot](https://www.herbibot.com ""grateful dead stats &amp; setlists""). below are links to stream the show(s) mentioned in your post. beep.  

[12/31/1987 - Oakland-Alameda County Coliseum Arena, Oakland, CA](https://www.herbibot.com/?show=1987/12/31)  |   
**Set 1:** Bertha, The Promised Land, Cold Rain and Snow, Little Red Rooster, When Push Comes to Shove, When I Paint My Masterpiece, Bird Song, The Music Never Stopped | **Set 2:** Hell in a Bucket, Uncle John's Band, Terrapin Station, Drums, Space, The Other One, Wharf Rat, Throwing Stones, Not Fade Away | **Encore:** Man Smart Woman Smarter, Iko Iko, Day-O (The Banana Boat Song), Knockin' on Heaven's Door | **Guests:**  Man Smart, Woman Smarter,  Iko Iko,  Day-O,  Do You Wanna Dance?,  Knockin' On Heaven's Door (with The Neville Brothers)",grateful_dead,1622505605,0,t3_npgtvd,t3_npgtvd,0,0.4461052715778351,0.533906877040863,0.4973677694797516,0.4435478746891022,0.4302298128604889
h04xyf4,ImAllergicToJerks,"Now that Daniel Day-Lewis has retired, Gary Oldman may just be the most versatile, talented active screen actor.

Love this.",tvPlus,1622505605,6,t3_npg6x9,t3_npg6x9,0,0.44204646348953247,0.5342975854873657,0.5069275498390198,0.44629836082458496,0.4294503331184387
h04xyf5,Yoloplayas,All day baby,ArizonaGirls,1622505605,2,t3_now4e6,t3_now4e6,0,0.4381748139858246,0.5352550148963928,0.5032953023910522,0.4419870376586914,0.4264460802078247
h04xyf7,occono,"Literally any music media will spoil the winner now, it's been over a week.",television,1622505605,26,t1_h04xpdc,t3_npekqi,0,0.4365972876548767,0.5388246178627014,0.5026518702507019,0.4438896179199219,0.4158063232898712
h04xyf8,KickOpenTheDoorBot,"You attacked without a weapon! 


| Damage | XP | Gold | 
|:--:|:--:|:--:| 
| 42 | 4 | 10 |


&gt; You are currently level 1 (4/33).

 &gt; The boss has **442430** health remaining!

 &gt; You are currently **Rank E**! ^(25 pts)

---

^(Welcome all to KOTD! Dont forget to join your race in boss raids! https://discord.gg/2edtM47)",kickopenthedoor,1622505605,1,t1_h04xwrm,t3_np9d83,0,0.4437044858932495,0.53525310754776,0.5047852993011475,0.43237751722335815,0.4218800961971283
h04xyf9,Caykous,"The cop literally hit the cat, that's animal abuse",PublicFreakoutX,1622505605,3,t3_nfepvp,t3_nfepvp,0,0.44140148162841797,0.5369710326194763,0.5016303658485413,0.44715145230293274,0.4257831275463104
h04xyfa,pjthegreat1234,You know disney makes places for childre....you sick fuck,hentaimemes,1622505605,3,t1_gzw61xt,t3_nm2f37,0,0.4441337287425995,0.5331986546516418,0.5034370422363281,0.4429728090763092,0.4300033152103424
h04xyfb,Spintown,Your too busy focusing on all the new stuff he's telling you about in the update videos. ;p,CaptainSparklez,1622505605,1,t1_h04wu1x,t3_np6cus,0,0.43224090337753296,0.5421437621116638,0.5095804929733276,0.4427977204322815,0.42180559039115906
h04xyfc,Clayman8,"Im fatphobic. As in ""im afraid of getting fat"".",Cringetopia,1622505605,1,t3_np7sgn,t3_np7sgn,0,0.44045019149780273,0.5429258942604065,0.5080108642578125,0.44643688201904297,0.4215468466281891
h04xyfd,Mycobacterium,"Relax. It gets better. One day you wake up and you have time to pursue your own interests again. In the grand scheme of things there is nothing harder than that first couple years...but then it’s over and you can actually enjoy being a parent. My son is 7 and I love hanging out with him now, just talking while riding bikes together or whatever.",Showerthoughts,1622505605,2,t1_h04pls8,t3_np8n8a,0,0.4365360736846924,0.5416150689125061,0.5154861807823181,0.4482435882091522,0.426084965467453
h04xyff,lokilockeddown,"Well it's fairly confusing on what exactly to do in a society hell-bent on analyzing and often mistaking all things men do as sex driven.

I have a fairly easy time getting laid btw, it's easier as a man to just kind of sit back and let all this shit go and just be fake until you know the person you are dealing with.

They can either be way too extreme and think mutual drunken sex is rape. Those people are scary.

Or worse, there's the type of people who don't understand social boundaries.

Between the two extremes it's easier to just be an asshole.",TrueOffMyChest,1622505605,2,t1_h043ycg,t3_np5j9q,0,0.4372026026248932,0.5346603393554688,0.5075205564498901,0.44489750266075134,0.43591395020484924
h04xyfg,GigantapenisaurusRex,"I’ve had her for a year, she does this during her bread-making. She stops and looks up at me like that haha",cats,1622505605,5,t1_h04xpcq,t3_npgqzy,0,0.431488960981369,0.5421608686447144,0.5138829946517944,0.4483589828014374,0.4252537488937378
h04xyfi,herbibot,"beep. ima [bot](https://www.herbibot.com ""grateful dead stats &amp; setlists""). below are links to stream the show(s) mentioned in your comment. beep.  

 [12/31/1987 - Oakland-Alameda County Coliseum Arena, Oakland, CA](https://www.herbibot.com/?show=1987/12/31)  |   
**Set 1:** Bertha, The Promised Land, Cold Rain and Snow, Little Red Rooster, When Push Comes to Shove, When I Paint My Masterpiece, Bird Song, The Music Never Stopped | **Set 2:** Hell in a Bucket, Uncle John's Band, Terrapin Station, Drums, Space, The Other One, Wharf Rat, Throwing Stones, Not Fade Away | **Encore:** Man Smart Woman Smarter, Iko Iko, Day-O (The Banana Boat Song), Knockin' on Heaven's Door | **Guests:**  Man Smart, Woman Smarter,  Iko Iko,  Day-O,  Do You Wanna Dance?,  Knockin' On Heaven's Door (with The Neville Brothers)",gratefuldead,1622505605,0,t3_npgse7,t3_npgse7,0,0.4473358690738678,0.5339488983154297,0.4970027804374695,0.44402652978897095,0.4303038418292999
h04xyfj,Mcatatonic1,"Shake stans, may I present to you:

Tyrese Maxey",sixers,1622505605,28,t3_npeihe,t3_npeihe,0,0.4419598877429962,0.5341566205024719,0.5004514455795288,0.4464840292930603,0.42594048380851746
h04xyfk,flowerwoven,Employment isn't an option. She's a pregnant woman.,prolife,1622505605,1,t1_h03tzcj,t3_nook8o,0,0.43909794092178345,0.5398563742637634,0.5093750953674316,0.44392135739326477,0.4267444610595703
h04xyfm,MooseFlyer,Idk if they actually sold at that price but I believe The priciest MTL tickets were more like $10k,hockey,1622505605,3,t1_h04xird,t3_npf4g8,0,0.4398854374885559,0.5316735506057739,0.5019409656524658,0.448458731174469,0.4277864396572113
h04xyfn,victoriabellexo,Want to see more of me? [MY ONLYFANS](https://onlyfans.com/victoriabelle),onlyfanbabes,1622505605,1,t3_npgu6e,t3_npgu6e,0,0.43794524669647217,0.537153422832489,0.5035971999168396,0.44479766488075256,0.4321494996547699
h04xyfo,qznc_bot2,"There is a [discussion on Hacker News](http://news.ycombinator.com/item?id=27347818), but feel free to comment here as well.",hackernews,1622505605,1,t3_npgu6q,t3_npgu6q,0,0.43180879950523376,0.5383669137954712,0.5059792995452881,0.44216716289520264,0.4263947010040283
h04xyfq,Epic_Pewdiepie_fan,no i just got told it is the conjunctiva.,explainlikeimfive,1622505605,1,t1_h0186sz,t3_noogyk,0,0.4264543652534485,0.5445845723152161,0.5128276944160461,0.45115023851394653,0.4318656623363495
h04xyfr,luckyDoge88,😁👏🏼👏🏼👏🏼👍🏼👍🏼👍🏼,dogecoin,1622505605,1,t3_npetmr,t3_npetmr,0,0.4403887689113617,0.5407419800758362,0.4999741315841675,0.4468129873275757,0.4309910833835602
h04xyfs,StrixOccidentalisNW,"Good advice. Please dispose quick, both house pets and wild animals could die from this. Unfortunately it is fairly common with owls and other birds of prey since their instinct is to catch injured and twitching prey.",whatisthisthing,1622505605,3,t1_h04xgrw,t3_npga8m,0,0.42926836013793945,0.5445078611373901,0.5008276104927063,0.44322460889816284,0.4232940673828125
h04xyft,Open_Film,"They were way too sensitive and strict with their policies. I also found it quickly turned into an echo chamber and if your view on a matter differed, you would quickly be ganged up on by snarky passive aggressive and border line bullying type comments. It was a keyboard warriors paradise. Glad that place is shutting down, it was awful but had some perks. I’m guessing it was a financing issue - how many active users do they have to raise advertising revenue with. Reddit is a much more cost effective solution.",LawCanada,1622505605,4,t1_h04qoj5,t3_np6tav,0,0.43081989884376526,0.5365996360778809,0.5077978372573853,0.4425587058067322,0.43120691180229187
