id,author,body,subreddit,created_utc,score,parent_id,link_id,controversiality,openness,conscientiousness,extraversion,agreeableness,neuroticism
h04xylp,babushka86,"Aah I was scared of that being a possibility, so you think calling fish and wildlife services is a good idea?",Aquariums,1622505607,1,t1_h04xkxg,t3_npgiev,0,0.43979594111442566,0.5367354154586792,0.5008777379989624,0.44600051641464233,0.42334848642349243
h04xylq,Kingindanorff,I don’t think the system wo,PrequelMemes,1622505607,3,t3_np9gso,t3_np9gso,0,0.43991973996162415,0.5362837910652161,0.5040786862373352,0.4452667832374573,0.4281017780303955
h04xylr,Phrogster,Go ahead and do the one that says US citizens born in Africa. It's a pre-screener and you'll get paid for it.,ProlificAc,1622505607,3,t1_h031906,t3_noyyyi,0,0.4349893033504486,0.5369714498519897,0.5044281482696533,0.4460528790950775,0.4242863655090332
h04xyls,rebelNred,A well placed phone and a relatively empty laundry mat 😅,gonewild30plus,1622505607,2,t1_h04nb4p,t3_np7c96,0,0.4394453763961792,0.5382344722747803,0.5037035346031189,0.44653964042663574,0.4333476722240448
h04xylt,HotlineSynthesis,Nah I called you out,StarWars,1622505607,1,t1_h04g1fs,t3_nob4vm,0,0.44557058811187744,0.5372543334960938,0.49976032972335815,0.4488016963005066,0.42538654804229736
h04xylu,Fahrenheit666,"You could get some basic tools and rig up a diesel heater for your truck camper (with a separate diesel tank). All you really need is a Jackery/goal zero or similar, a hole for the exhaust, and $200 for a Chinese diesel heater plus a portable enclosure.

For 1-2k I’m sure you could find a used slide in truck camper too. 

Also, if you’re in the Midwest/Great Lakes, rent is dirt cheap, especially with roommates",vandwellers,1622505607,2,t3_npbmlm,t3_npbmlm,0,0.43775394558906555,0.5365131497383118,0.5108445882797241,0.44559380412101746,0.43083661794662476
h04xylv,theinfinitejar,"At some point I would like this website to understand that a person moving with significant speed is more dangerous than someone standing still even if they elbow or crosscheck. 

I know I'd much rather feel like Ryan Graves today than Justin Faulk the day after he got hit.",hockey,1622505607,3,t1_h04wfhh,t3_npftsx,0,0.43868398666381836,0.5358873605728149,0.508167028427124,0.44002941250801086,0.4252077043056488
h04xylw,Chastity_belt_buckle,"Why yes, yes it does!",shittysuperpowers,1622505607,3,t1_h04xusp,t3_np821m,0,0.4401080310344696,0.5396589636802673,0.5039699077606201,0.4406111538410187,0.42542147636413574
h04xylx,mysluttyaccount346,Tell me more,forcedbreeding,1622505607,1,t1_h04xt00,t3_npgsge,0,0.4407999515533447,0.5413430333137512,0.5014050006866455,0.4494311809539795,0.42581894993782043
h04xylz,PlayboyOnReddit,[Link to original post here](https://www.reddit.com/r/Playboy/comments/np15ba/nikki_leigh/),PlayboyOnReddit,1622505607,1,t3_npgu9a,t3_npgu9a,0,0.43954741954803467,0.5372530817985535,0.5072004795074463,0.4468017518520355,0.4332864582538605
h04xym0,ThatOneClassyRetard,"I mean to be fair people dont send dick pics to go on dates, they want to jump straight into clapping cheeks",u_SrGrafo,1622505607,-10,t1_h04iwnc,t3_npbmas,0,0.441190242767334,0.5362328886985779,0.5045260787010193,0.44769689440727234,0.43379348516464233
h04xym2,IrohsSlipper,"Also just started playing - Expected a rough few hours - they were an absolute joy to play however, was scratching my head wondering what people are complaining about. 

The only desire I have is to be able to turn off the narrator during dialogue with NPCs - They oddly have quite a bit of personally, if you have enough imagination.  

The exploration and chill factor is amazing, the combat is way better than I expected and the issues that people were bringing up are way less jarring than I thought they may be. I found 3 chests behind a waterfall!  The game rewards exploration which I adore!

Can't wait to jump back in!",biomutant,1622505607,4,t3_npaawf,t3_npaawf,0,0.4347722828388214,0.5336254835128784,0.5055985450744629,0.4385266602039337,0.42967021465301514
h04xym3,fellongreydaze,"Were you very close to retiring and found revitalization in a new stable with Bobby Lashley, Shelton Benjamin, and Cedric Alexander? Because you're the real MVP.",SquaredCircle,1622505607,4,t1_h04xrnw,t3_npetrn,0,0.4364112615585327,0.5443763136863708,0.5017725229263306,0.4525268077850342,0.4265248775482178
h04xym4,thatguyfrom1975,"There’s not a lot of community arrangements.  The DFW area is huge.  Rangers own north central Texas and there are a lot of poor communities that aren’t on there.  Maybe that’s where we should strive for first instead of sexuality and exclusivity to get the financially challenged in the game, which is gender and sexuality benign.",TexasRangers,1622505607,4,t1_h04x764,t3_np82mv,0,0.43428224325180054,0.5350224375724792,0.5059876441955566,0.43468618392944336,0.4272474944591522
h04xym5,Guilty_Mall_3720,It was 9.00 for me probably where your located,GorillaMind,1622505607,2,t3_np9nxb,t3_np9nxb,0,0.43929293751716614,0.5347253084182739,0.5014308094978333,0.44800257682800293,0.42753225564956665
h04xym6,clinkers08,no worries! GT: ikilldolpheeens,RocketLeagueExchange,1622505607,1,t1_h04xn8f,t3_npgbkh,0,0.43840059638023376,0.5356472730636597,0.5038862824440002,0.44489070773124695,0.4251772165298462
h04xym7,Basic_enthusiasm,Thank you Captain Hindsight!,RealEstateCanada,1622505607,2,t1_h04w3k5,t3_npf448,0,0.4409072697162628,0.5380659699440002,0.5042129755020142,0.44288310408592224,0.4217318892478943
h04xym8,Lusicale,"Maybe when I get a Doom I can try it, since I only found one of the hypershunts so far. Still I found this way very straightforward all the while using ships that a player will probably be able to manufacture before Dooms. At least I'm in endgame and still haven't found the Doom blueprint.",starsector,1622505607,1,t1_h04rs59,t3_npaw95,0,0.42679160833358765,0.5422084927558899,0.5039873719215393,0.44113045930862427,0.42597338557243347
h04xym9,newsdk,poster.py is being executed,newsdk,1622505607,1,t3_nonvb6,t3_nonvb6,0,0.445181280374527,0.5332759618759155,0.49891337752342224,0.4513464570045471,0.4240422546863556
h04xyma,mainhoonmadrasi,"CamScanner is a Chinese app and I would guess, it status your data 100% of the time in the garb of you scanning your data.",androidapps,1622505607,6,t1_h02p55c,t3_nox6ws,0,0.43078193068504333,0.5424996614456177,0.507734477519989,0.44569000601768494,0.42676424980163574
h04xymb,diegie-,Our bench is gonna be so good when our young guys get older,sixers,1622505607,9,t3_npeihe,t3_npeihe,0,0.4383508563041687,0.5377926826477051,0.5038172006607056,0.4481657147407532,0.4278509020805359
h04xymd,reelnb,"He’s had a better points per game pace, and if he hadn’t suffered through the same scoring drought our entire roster did near the end of the year he would’ve been much higher",BlueJackets,1622505608,3,t1_h04xp6c,t3_np8iqr,0,0.4409617781639099,0.5383883714675903,0.5072991847991943,0.44906896352767944,0.42640185356140137
h04xyme,luv2bstuffed,It’s when you stick a metal or silicone rod into your urethra.,AskRedditAfterDark,1622505608,2,t1_h04tj1s,t3_npefc1,0,0.435445100069046,0.5432183742523193,0.5082694292068481,0.44434019923210144,0.4325363337993622
h04xymg,Rude_Doubt3439,Let’s goooooo,SilkMoonToken,1622505608,1,t3_npgkx5,t3_npgkx5,0,0.44047844409942627,0.5337359309196472,0.5049925446510315,0.44627195596694946,0.4316532611846924
h04xymh,Dragonthorn1217,Agree. Was referring to getting key stops when we need them. Hawks have hit a lot of big shots the entire series despite scoring below their average.,NYKnicks,1622505608,2,t1_h04brkw,t3_np697g,0,0.43154698610305786,0.5370101928710938,0.503309965133667,0.4473477303981781,0.42477113008499146
h04xymi,Walla2kate,The daughter is 18! He's really going to ground her?  The son is 16. I think he may not see either of them this summer.,AmITheDevil,1622505608,304,t3_npf6u0,t3_npf6u0,0,0.43999895453453064,0.5372756719589233,0.5080950260162354,0.44169723987579346,0.4292229413986206
h04xymj,KickOpenTheDoorBot,"You attacked without a weapon! 


| Damage | XP | Gold | 
|:--:|:--:|:--:| 
| 4 | 3 | 9 |


&gt; You are currently level 1 (21/33).

 &gt; The boss has **1486** health remaining!

 &gt; You are currently **Rank C**! ^(170 pts)

---

^(Welcome all to KOTD! Dont forget to join your race in boss raids! https://discord.gg/2edtM47)",kickopenthedoor,1622505608,1,t1_h04xxbn,t3_npfs87,0,0.44298413395881653,0.5352217555046082,0.5055616497993469,0.4330255091190338,0.4216597080230713
h04xymk,emperorbob1,Who has a lot of needless focus just like OG Taichi did. If anything that's the issue they didn't fix that issue with OG.,digimon,1622505608,1,t1_h02svvk,t3_nohp0g,0,0.434974730014801,0.5409297943115234,0.5091358423233032,0.4416724145412445,0.42425069212913513
h04xyml,yackofalltradescoach,Like he is a pedophile who eats children? Or he eats children that practice pedophilia?,Damnthatsinteresting,1622505608,5,t1_h04s8my,t3_npbz81,0,0.4387756586074829,0.5400252342224121,0.49841466546058655,0.4407278597354889,0.43419602513313293
h04xymm,Kevrack_Invades,Who tf called it a ‘Puter’,pcmasterrace,1622505608,-1,t3_np6one,t3_np6one,0,0.4442614018917084,0.5310044884681702,0.5070153474807739,0.44039052724838257,0.4303491413593292
h04xymn,LessO2,The reason Murph wears 2 is because that’s about his body fat count….dude is fit.,Mariners,1622505608,19,t1_h04wyr7,t3_npgjas,0,0.43688008189201355,0.5442529916763306,0.5127120018005371,0.44655314087867737,0.4231024980545044
h04xymo,TurbulentMiddle2970,The statue of unity in India. Its 600ft tall,AskReddit,1622505608,2,t3_nosug2,t3_nosug2,0,0.44267529249191284,0.5384879112243652,0.5036274790763855,0.4489039182662964,0.4249417185783386
h04xymp,kay_mac,"Selling 1 GA 4 ticket at face value, would like around $400, but price is negotiable. The wristbands are being physically shipped. I can no longer go due to work/scheduling conflicts.",Lollapalooza,1622505608,1,t3_ng4d20,t3_ng4d20,0,0.43272966146469116,0.5427200794219971,0.5054363012313843,0.4457378089427948,0.43163585662841797
h04xymq,OrganicTrust,He’s an enormously talented dude,Music,1622505608,98,t1_h04wuh1,t3_npfxz1,0,0.44172403216362,0.5365936160087585,0.5064370632171631,0.44829246401786804,0.4262692928314209
h04xymr,TheMultiBrony21,"I don't think it would, especially since she'd probably only use it in dire circumstances and while in Butterfly form

Or did you mean the mach 1000?.",StarVStheForcesofEvil,1622505608,2,t1_h04xv6u,t3_npceoj,0,0.42883405089378357,0.5403589606285095,0.5019630193710327,0.4456031620502472,0.4252929389476776
h04xyms,NighthawkFoo,"That sounds like an eBay auction, where the seller misspells the listing title and posts pictures taken by a potato.  

Congrats on snagging a home!",personalfinance,1622505608,5,t1_h04v1m1,t3_np9wwi,0,0.44248083233833313,0.5361737012863159,0.5033557415008545,0.44321227073669434,0.42277398705482483
h04xymt,just_one_random_guy,"Probably not, if Scotland wants out I’m sure they don’t want any amount of connection to the remainder of the UK including the monarchy, along with the queen probably not agreeing to a possible continuation of the monarchy in an independent Scotland since she’d more than likely support a United Britain over a divided one",monarchism,1622505608,3,t3_npgi04,t3_npgi04,0,0.4361373484134674,0.5321665406227112,0.5058968663215637,0.443829208612442,0.4322967529296875
h04xymu,Delete_Tick,What a bitch. What a fucking dumbass. Eating meat is racist? Are you fucking joking?,Cringetopia,1622505608,1,t3_np1iev,t3_np1iev,0,0.4433637857437134,0.5394212603569031,0.5028412342071533,0.4484345018863678,0.4275875389575958
h04xymv,trackedonwire,"Media just says ""Experts agree..."" or, ""Official sources agree..."".

Wash, rinse, repeat",conspiracy,1622505608,-1,t3_np4uap,t3_np4uap,0,0.4390150308609009,0.5385406017303467,0.5001949071884155,0.44946298003196716,0.4294033348560333
h04xymw,last_one_on_Earth,"ABC were forced* into a full 360** from their original position.

*(Yes, arbitration is voluntary but forced/consented... who is to say?)

** (Yes, 360 does mean no change in direction at all)",australia,1622505608,56,t1_h04w0o8,t3_npg4tw,0,0.44573527574539185,0.5327227711677551,0.4992157518863678,0.43222975730895996,0.4250917434692383
h04xymx,TapirDrawnChariot,She'll be removed unquestionably. Physical punishment in US schools hasn't been allowed for decades.,ActualPublicFreakouts,1622505608,3,t1_h04ta9d,t3_npcexx,0,0.4410080313682556,0.5358187556266785,0.5067784786224365,0.44007861614227295,0.4246636927127838
h04xymy,gbdavidx,Drink some wine or smoke some weed,DoesAnybodyElse,1622505608,1,t3_npef4i,t3_npef4i,0,0.4411522448062897,0.5394856929779053,0.4978938400745392,0.45085227489471436,0.4277007579803467
h04xyn0,skorpion99,You must be fun at bars,pureretention,1622505608,1,t1_h04xtre,t3_np7hoq,0,0.4409523904323578,0.539831280708313,0.5008564591407776,0.44820067286491394,0.425813764333725
h04xyn1,Tettamanti,"I do a 100g old starter/100g whole wheat/100g water change once a week.  I discard or cook with the discarded portion.  I sit it on the counter (about 72 degrees F) for about 5 hours.  After the 5 hours, I just screw the top on the mason jar and throw it in the fridge.  Repeat weekly.

When cooking, I do the same ratios and let it sit for 4 to 5 hours.  This part can't be rushed...It will help your final product.  If the starter doesn't bubble, do a few days of twice a day changes until it doubles in size within the 4-5 hours.",Sourdough,1622505608,1,t1_h03s8fh,t3_nozsv3,0,0.440558522939682,0.5419167280197144,0.5059210062026978,0.4440822899341583,0.42574769258499146
h04xyn2,iRunAir,you “tripped” cuz u rushing to hit em. nigga was being patient and dropped you,BruceDropEmOff,1622505608,22,t3_npgr41,t3_npgr41,0,0.441784143447876,0.5416725277900696,0.5098470449447632,0.44644924998283386,0.4234636723995209
h04xyn3,Fat_French_Fries,"/ub ""Thanks Gohan"" made my lose my shit god dammit",okbuddybaka,1622505608,8,t3_noph94,t3_noph94,0,0.43981844186782837,0.5364639759063721,0.5066010355949402,0.4476518929004669,0.42299482226371765
h04xyn5,parislevaroffical,"Omg stop... you’re joking... the first time I ever used my Ouija board, I got in contact with ZoZo (who is the so called “demon on the Ouija Board”) and my friends and I all woke up with bloody noses the next day... I’ve never heard of someone else having such a similar experience. I became a lot more experienced and in tune with my board but now I’m selling it because it’s served it’s purpose with me and I’d like to stick on the good side of the spirits hehe 🔮 buuuuuut that night we all asked ZoZo very personal questions about deaths in our families that no one else in the group knew and that’s when I was exposed to the truth that spirits exist! Crazy world, be careful😳",Ouija,1622505608,1,t1_gxnjnlu,t3_n8xqal,0,0.4289889633655548,0.5420029759407043,0.5061172246932983,0.44498032331466675,0.4315926730632782
h04xyn6,publicdefacation,yeah it's unfair on the other students all it does is make noise. Teachers should be allowed to get rid of disruptive students,ActualPublicFreakouts,1622505608,48,t1_h04m5t1,t3_npcexx,0,0.43942517042160034,0.5399450659751892,0.5109297037124634,0.4339790344238281,0.4304404556751251
h04xyn8,poeticentropy,"Could be, yeah.  I thought he was bleeding because of the knee rub in his face or the ice.  Skated on ice is really rough, as anyone who has slid skin across it knows, and the sock over the kneepad isn't super soft either.  

That hair being ripped out though... and I didn't see the camera angle presented by the NHL discipline video that really shows the knee squishing on Graves head.  Those two items alone more than justify the suspension in my mind.",hockey,1622505608,32,t1_h04we0j,t3_npg88k,0,0.43891042470932007,0.5312897562980652,0.5006462931632996,0.43932145833969116,0.4263889789581299
h04xyn9,NorthernNadia,As someone who enjoys the numbers every morning I'd be happy to do my part. Although I hope that goal is laughably low.,ontario,1622505608,14,t3_npfgti,t3_npfgti,0,0.43616047501564026,0.540266752243042,0.5037201642990112,0.439358115196228,0.4222693145275116
h04xyna,rT_Pulse,hope y'all ready to see this hit the 50-100,amcstock,1622505608,1,t3_noujln,t3_noujln,0,0.4422440826892853,0.5376006364822388,0.5024787187576294,0.4466821253299713,0.4272918403148651
h04xynb,PowerToTheHobos,"I can't carry you, but I can help you. I also just recently restarted playing, currently level 47. PM me if you are interested :)",Dofus,1622505608,2,t3_npbto9,t3_npbto9,0,0.4339804947376251,0.5412688255310059,0.5052563548088074,0.44499436020851135,0.4206025004386902
h04xync,turningtotheright,"I ran an offset smoker back in college for a year or so so I had a little experience but ever since then Iv been smoking using a Treager. After this first smoke you under estimate how much the CPU is actually doing for you on the Treager. However, it’s so much more satisfying once you done with your cook because of how much work you put in. My big piece of advice is learn you smoker, learn what the temp does when you open or shut the damper 1/2 way, or when you add a split of wood. They are great smokers and it’s so rewarding when you pull your meat off.",smoking,1622505608,2,t1_h04j3dl,t3_npc2bu,0,0.43822118639945984,0.5415273308753967,0.5094001293182373,0.4485553801059723,0.42691558599472046
h04xynd,PieJumpy7462,I'm in Canada and our hospital provided them. They even had cloth ones,pregnant,1622505608,4,t1_h04tdof,t3_npfpj3,0,0.42826542258262634,0.5401286482810974,0.5074285864830017,0.44445323944091797,0.4335898756980896
h04xynf,IncrediblyInflated,"How does satanic worship make something worse?

Also actual satanic worship in no way shape or form condones murder or sacrifice of humans",NarcoFootage,1622505608,9,t1_h04jdji,t3_npclq7,0,0.4402453899383545,0.5386857986450195,0.5010331869125366,0.4415026307106018,0.42647114396095276
h04xyng,Software_Fucker69,its acting bad,softwaregore,1622505608,1,t3_npg7ec,t3_npg7ec,0,0.4461923837661743,0.5350911021232605,0.5046166777610779,0.4454644024372101,0.4288159906864166
h04xyni,Izuku14,"Thats your fault, shouldve made pairs of upgrades of 3 while having your heroes upgrading, wanna see my th10, my heroes are nearly maxxed and I havent even started on my defenses",ClashOfClans,1622505608,6,t1_h04xuzw,t3_npgd50,0,0.43435725569725037,0.5412825345993042,0.5104841589927673,0.44497159123420715,0.42193788290023804
h04xynj,the_Pineman,"ooooooooooooooooooooh, right right",memes,1622505608,3,t1_h04xl17,t3_npb2oh,0,0.44039949774742126,0.5360175967216492,0.49613624811172485,0.4447043240070343,0.42967769503593445
h04xynk,Clear_Hair3348,Let's be real. Who actually like the face covering.,ShinyPorn,1622505608,-1,t3_np7cjj,t3_np7cjj,0,0.4315909147262573,0.5380390286445618,0.502633810043335,0.4388402998447418,0.42895740270614624
h04xynm,Peachieskick,oh i was thinking for the halo but okay!,Cross_Trading_Roblox,1622505608,1,t1_h03mph4,t3_nouu44,0,0.4391440153121948,0.535835325717926,0.5050305128097534,0.4445091485977173,0.42418259382247925
h04xynn,Heffamac,sorry...gotta go. bummed I'll probably miss you finishing.  I'll have to catch up,TheArtistStudio,1622505608,1,t3_npfszj,t3_npfszj,0,0.43928489089012146,0.5368764996528625,0.5021955966949463,0.44375309348106384,0.4210529327392578
h04xyno,TheValhallaFox,I bet you can keep up~,DraculaBiscuits,1622505608,2,t1_h02yo50,t3_nophl8,0,0.44393667578697205,0.5341320633888245,0.5011376142501831,0.4481516182422638,0.4258251488208771
h04xynp,Reaper_does_things,I’m having a actual blade and everything handcrafted. There’s a person in my town who does it professionally. But it sure is pricy,knives,1622505608,1,t1_h04vit7,t3_np58k1,0,0.43401244282722473,0.5415314435958862,0.5093326568603516,0.4454253911972046,0.4258078932762146
h04xynq,Tommy-1111,I cannot believe these fucking dirt bag deplorable Republicans trying to pass this shit!?! I hope they get their asses sued.,democrats,1622505608,2,t3_np3vra,t3_np3vra,0,0.4270114004611969,0.5412672758102417,0.5055436491966248,0.44170480966567993,0.434138685464859
h04xynr,lXlNeMiSiSlXl,Let's discuss the auto-ban system and how terrible of an idea it is.,deadbydaylight,1622505608,2,t3_nn6cgk,t3_nn6cgk,0,0.4293791949748993,0.5425967574119568,0.507166862487793,0.44130316376686096,0.4222109019756317
h04xynt,churchofbabyyoda420,"The dark side clouds everything. Impossible to see the light, the future is.",FreeSpeech,1622505608,-1,t3_npgts3,t3_npgts3,0,0.42613136768341064,0.5465821027755737,0.5082623958587646,0.44080522656440735,0.42629337310791016
h04xynu,Alex_Lanew06,there is going to be at least one new teacher next year unless they really can't find someone to work,heirway,1622505608,1,t3_npgpd3,t3_npgpd3,0,0.443326860666275,0.5347806215286255,0.5012956261634827,0.4483833312988281,0.43211501836776733
h04xynv,sm0lpeppy,But let there be a money glitch or Benny's merge glitch and they are ON that shit 🤦‍♂️ for fucks sake the god mode Speedo has been out for years,GTA5Online,1622505608,1,t1_gzy0anv,t3_nnzfb5,0,0.44684821367263794,0.533681333065033,0.5072407126426697,0.44184333086013794,0.4273117482662201
h04xynx,cygnet_ring,Can't decide if that's better or worse!,insects,1622505608,1,t1_h042t94,t3_np9hwq,0,0.44150587916374207,0.5362680554389954,0.5006325244903564,0.44143548607826233,0.4226055145263672
h04xyny,DrMansionPHD,I think her and Bieksa work well on the panel though. You need opposite opinions but they both have to have good ones.,leafs,1622505608,1,t1_h04xva6,t3_npdb4c,0,0.43226009607315063,0.538228452205658,0.5019292235374451,0.44284218549728394,0.42462968826293945
h04xynz,Carnivore90,"But having diarrhea IS kind of colon cleansing, no? Perhaps I’m wrong.. either way I like the feeling after.",NoStupidQuestions,1622505608,1,t1_h04xtwi,t3_npgpqv,0,0.43092337250709534,0.5410675406455994,0.5058259963989258,0.44010311365127563,0.42017197608947754
h04xyo0,_AlreadyTaken_,Didn't I see this guy standing  on a street corner screaming obscenities at strangers?,insanepeoplefacebook,1622505608,1,t3_npajv3,t3_npajv3,0,0.4396000802516937,0.5406875610351562,0.4972316324710846,0.44582653045654297,0.4302816689014435
h04xyo4,grimyraccoonhands,"Yeah peeing for me is a must, I freak out if I dont xD and yeah I kinda want a bidet now!",TwoXSex,1622505608,5,t1_h04u1s9,t3_np65y0,0,0.44284775853157043,0.5327154397964478,0.5061544179916382,0.4451597332954407,0.4269018769264221
h04xyo5,allflour,"I am new to houseplants, shipping plants, etc; is there a mentee/mentor program that I can be paired with someone to answer questions and look at pictures of my plants for potential trade? Thank you in advance. 

I ended up with pothos vines as my first plants, have learned to propagate them pretty well, just need tiny assistance for clarifications. Will be in search of some tiny cactus for spouse’ mini planter, other than that pretty open; have been trying to get an idea of what I like.",TakeaPlantLeaveaPlant,1622505608,1,t3_myya0f,t3_myya0f,0,0.43201330304145813,0.5447385907173157,0.5080617666244507,0.4410302937030792,0.4312070906162262
h04xyo8,w3bar3b3ars,As if Sweden isn't spying on Merkel,worldnews,1622505608,1,t3_np1ch5,t3_np1ch5,0,0.44130218029022217,0.538066029548645,0.5035334229469299,0.44977858662605286,0.42393338680267334
h04xyo9,DjN0tNice,But Tim Horton’s said Weber is first ballot,leafs,1622505608,1,t1_h04xgl6,t3_npdb4c,0,0.4424801766872406,0.5366073846817017,0.5040559768676758,0.44294634461402893,0.42293795943260193
h04xyob,carbonquellist,Thank you Malwa! You incredible River photog!,MenOfNightCity,1622505608,4,t1_h04cvvu,t3_np4453,0,0.4367373287677765,0.5393236875534058,0.5032857656478882,0.44321659207344055,0.41979849338531494
h04xyoc,arikawanohimegoto,Any account I've had has had these guys coming up and posting really nasty stuff at me because I commented something even slightly right-wing in a totally different sub.  It's pathetic.,4chan,1622505608,1,t1_gsioyvv,t3_m03hco,0,0.43702980875968933,0.5365892648696899,0.5052586197853088,0.43997812271118164,0.423618882894516
h04xyod,hcneyedde,"10/10 The name fits well with your oc! I also love the design. Tbh i would see this in a horror game, i just see it! But the overall whole “thing” is good!",GachaClub,1622505608,2,t1_h04wvbm,t3_npfzzy,0,0.4321800172328949,0.5396102070808411,0.5056217908859253,0.4435124099254608,0.4188879430294037
h04xyoe,FakespotAnalysisBot,"This is a Fakespot Reviews Analysis bot. Fakespot detects fake reviews, fake products and unreliable sellers using AI.

Here is the analysis for the Amazon product reviews:

&gt;**Name**: BlenderBottle ProStak Twist n' Lock Storage Jars Expansion 2-Pak with Pill Tray, All Black 

&gt;**Company**: Blender Bottle

&gt;**Amazon Product Rating**: 4.7 

&gt;**Fakespot Reviews Grade**: B

&gt;**Adjusted Fakespot Rating**: 4.7

&gt;**Analysis Performed at**: 12-07-2020 

[Link to Fakespot Analysis](https://fakespot.com/product/blenderbottle-prostak-twist-n-lock-storage-jars-expansion-2-pak-with-pill-tray-all-black) | [Check out the Fakespot Chrome Extension!](https://chrome.google.com/webstore/detail/fakespot-analyze-fake-ama/nakplnnackehceedgkgkokbgbmfghain)

*Fakespot analyzes the reviews authenticity and not the product quality using AI. We look for real reviews that mention product issues such as counterfeits, defects, and bad return policies that fake reviews try to hide from consumers.*

*We give an A-F letter for trustworthiness of reviews. A = very trustworthy reviews, F = highly untrustworthy reviews. We also provide seller ratings to warn you if the seller can be trusted or not.*",Huel,1622505608,-2,t3_npgkgh,t3_npgkgh,0,0.44110625982284546,0.5387444496154785,0.5054845809936523,0.4406101703643799,0.4317912459373474
