id,author,body,subreddit,created_utc,score,parent_id,link_id,controversiality,openness,conscientiousness,extraversion,agreeableness,neuroticism
h04xy27,brandomango,This subreddit is a microcosm of the fan base. What do you think Instagram and Twitter look like? What do you think the players’ DMs look like?,leafs,1622505600,0,t1_h04xser,t3_npdb4c,0,0.42922577261924744,0.5358191132545471,0.5036178827285767,0.4414459764957428,0.4291740357875824
h04xy28,PineValentine,You are indeed so cool!,cottagecore,1622505600,2,t1_h03zm8p,t3_noxvw4,0,0.441225528717041,0.538145899772644,0.5025506019592285,0.4433631896972656,0.42416226863861084
h04xy2b,millennialpink2000,Then have the gall to complain the spark is gone,FemaleDatingStrategy,1622505600,9,t1_h04h63k,t3_noygj8,0,0.44286686182022095,0.5397706627845764,0.504515528678894,0.4486466646194458,0.42953529953956604
h04xy2c,svenhoek86,Not in the playoffs against the Steelers.,SquaredCircle,1622505600,1,t1_h0312hw,t3_noz9un,0,0.43759918212890625,0.536915123462677,0.5008534789085388,0.4449801743030548,0.42711952328681946
h04xy2d,FlaymerLoL,“It takes a different breed of person to wake up everyday at 3 am to unload trailers.” - My SD,Target,1622505600,12,t3_np9ejk,t3_np9ejk,0,0.42879220843315125,0.5373455882072449,0.5085400938987732,0.4405360519886017,0.42985427379608154
h04xy2e,NSFW_Hunter63,"Alrighty, I'll talk ""qualifications"" Teddy Roosevelt was a war hero with very minimal in the way of education. George Washington had even less education and while he was a war hero he was far from the greatest tactician and often called on others for planning and strategy. George W. Bush was a businessman. Ronald Reagan was just an actor who won office purely through popularity. Trump is a failing entrepreneur who sought the presidency for financial gain. Bit of a pattern here as most of the presidents whom didn't have ""qualifications"" would have fallen under the modern definition of republican. If you'd like some proof. Abe Lincoln was a democrat and studied law. Barak Obama was a lawyer who studied at Harvard Law. And Joe Biden studied law at Syracuse University. As far as Kamala Harris, She studied at the UC Hastings College of Law in 1989 meaning that not only is her education exceeding Donald Trump's and many other candidates, it's also more recent and up-to-date as far as newer laws and ways we deal with legal issues.",insanepeoplefacebook,1622505600,1,t3_npajv3,t3_npajv3,0,0.43294718861579895,0.5468510985374451,0.5051705241203308,0.4447343647480011,0.4288856089115143
h04xy2f,ExtensionAgreeable55,he doesn't owe friends respect,theJoeBuddenPodcast,1622505600,95,t3_npghpq,t3_npghpq,0,0.44441497325897217,0.5384220480918884,0.5017299652099609,0.4500427544116974,0.426288366317749
h04xy2g,Congress1818,and there were PLENTY of people who detest everything that mob stands for from all walks of life too!,neoliberal,1622505600,6,t1_h04nss9,t3_np9oyh,0,0.43627047538757324,0.5353536605834961,0.49767282605171204,0.4372537434101105,0.43007659912109375
h04xy2h,Fukshit47,Turns out the red was just the hard candy shell,interestingasfuck,1622505600,23,t3_npeear,t3_npeear,0,0.44095686078071594,0.5361166000366211,0.5023843050003052,0.4473387897014618,0.4291973114013672
h04xy2j,hallowers,"...You do realize that's why vehicle harnesses exist, right?

Edit: Also, rear-end collisions are the most common type. So even if you're playing a numbers game, keeping them in the vehicle is safer.",IdiotsInCars,1622505600,28,t1_h04xpnq,t3_npc1yl,0,0.4382908344268799,0.5379568338394165,0.49867233633995056,0.4376087486743927,0.4298934042453766
h04xy2k,dalailama20,Hang in there. Good job asking for help. Keep posting. Please watch the Sexual Self-mastery series of videos on YouTube by UniversalMan.,NoFap,1622505600,2,t3_npgr82,t3_npgr82,0,0.43653425574302673,0.5391655564308167,0.5099284648895264,0.4483063519001007,0.42635414004325867
h04xy2l,BrownSugarBare,"3 kids in my fam, my dad put a bike helmet on for every ""first"" driving lesson he took us out for. No shame that the joke was old by the time he got to the third kid, proudly waved at people while one of us was driving.",Unexpected,1622505600,19,t1_h04g1p5,t3_npc0sg,0,0.4320388436317444,0.5463842153549194,0.5082818865776062,0.4493246078491211,0.4266778528690338
h04xy2m,Lowkey-Loki87,This is clearly gaslighting.,funny,1622505600,459,t3_npcj9g,t3_npcj9g,0,0.4306319057941437,0.5385140776634216,0.5097066760063171,0.4446398913860321,0.4298683702945709
h04xy2n,Diab01ica1,"What is this, a video store for *ants*!?!?!?",RedLetterMedia,1622505600,8,t1_h0365v7,t3_np54zx,0,0.44196635484695435,0.5340924859046936,0.5015577077865601,0.4356308579444885,0.4294906258583069
h04xy2o,BrandiBraids,[SOURCE](https://www.pornhub.com/view_video.php?viewkey=ph605923b547d99),pigtails,1622505600,4,t3_npgtxe,t3_npgtxe,0,0.4386403560638428,0.5344840884208679,0.5024707913398743,0.4481987953186035,0.43027403950691223
h04xy2p,Biboivirgin,If you’ll send me bread to get gas I’ll drive to u and let’s u fuck the shit outa me with that 🥲🥵,GayNYC,1622505600,1,t3_np7sgt,t3_np7sgt,0,0.4398888051509857,0.5373973846435547,0.5075541138648987,0.44805386662483215,0.427683025598526
h04xy2q,starrpamph,Well it says you've added $500 - that's a good thing right?,PublicFreakout,1622505600,228,t1_h04xvqp,t3_npai89,0,0.44033360481262207,0.538297712802887,0.49841052293777466,0.442347913980484,0.4231216609477997
h04xy2r,GreenMarketGroup,Yeah cost me $38 to transfer 58$ last night.. this has to be fixed ASAP. Huge opportunity for another blockchain IMO especially since 2.0 is so delayed. Tell me why I shouldnt be worried plz...,ethereum,1622505600,-5,t3_np6eai,t3_np6eai,0,0.4312027394771576,0.5389194488525391,0.5049899816513062,0.4454295039176941,0.42230501770973206
h04xy2s,rT_Pulse,we fucking blowing this week apes,amcstock,1622505600,1,t3_noujln,t3_noujln,0,0.4423471689224243,0.5363112688064575,0.50238436460495,0.44740602374076843,0.42714837193489075
h04xy2t,burkie17,Demar? Denault.,leafs,1622505600,1,t1_h04x9xj,t3_npdb4c,0,0.43540525436401367,0.5445218682289124,0.502168595790863,0.44192370772361755,0.42890429496765137
h04xy2v,Shuikai,"Given your severe symptoms despite being so young (21 M) I would really recommend aggressive treatment, it's better to do this kind of stuff while you're young than procrastinate and let it get progressively worse.

I agree the sleep study is a great idea, I would also try and make sure the sleep lab uses the AASM 1A criteria (3% desaturation) for hypopneas (as opposed to 4%) to try and avoid the possibility of a false negative, it can be an issue in especially young and thin OSA cases.

CPAP could also help improve your symptoms if you do test positive, though there are arguments for jaw surgery as well, such as the fact you may not need a CPAP after jaw surgery, the cosmetic side, and even some people find CPAP doesn't work for them at all (either ineffective or can't sleep with it). Some people call it a last resort but for a 21 year old personally I don't think it's a big deal, sure the recovery sucks but afterwards you'll have a new jaw for your entire life.

If you want to see an ortho who specializes in the jaw I would see an MSE provider from this list: [https://www.moonmse.com/distributors-1](https://www.moonmse.com/distributors-1)",jawsurgery,1622505600,2,t3_npg0ok,t3_npg0ok,0,0.43994808197021484,0.5419299006462097,0.5153895020484924,0.44282108545303345,0.43117961287498474
h04xy2x,Pochusaurus,if you’re in this and want usd then gtfo. The whole point of crypto is to topple the dollar,EtherMining,1622505600,-4,t1_h036mfp,t3_np2vn7,0,0.43083998560905457,0.5418800711631775,0.5106523036956787,0.4439487159252167,0.421131432056427
h04xy2z,Successful_Respect78,Love too.  Hiw how do i do it. Please.,GoneWildCD,1622505600,2,t3_nolc8n,t3_nolc8n,0,0.433411568403244,0.544025719165802,0.5063645839691162,0.4461440443992615,0.425966739654541
h04xy30,SirLong3,"Upvoted, please upvote the top post on my profile in return :)",FreeKarma4U,1622505600,1,t1_h04w98d,t3_npgis9,0,0.440836638212204,0.5390245318412781,0.5027944445610046,0.4480632543563843,0.4280049800872803
h04xy31,Ku7d33p,All in AMC 🚀🚀🚀🦍🦍🦍💎💎💎✊✊✊,wallstreetbets,1622505600,13,t3_npbyt0,t3_npbyt0,0,0.4377036988735199,0.5423681735992432,0.5007748007774353,0.4478926360607147,0.4300582706928253
h04xy32,BoxOfBytes,"Ouch. I had to deal with a love seat. I came to a complete dead stop and  vehicles behind  me started to stop and swerve. 2 vehicles ended up on side ditch. The 2 individuals who were transporting the love seat just put it on the roof of their civic secured by one hand from each person. They were watching this on the side of the road while it was happening, hoping to get it back. They left immediately after highway patrol arrived.",Dashcam,1622505600,26,t3_npbvxs,t3_npbvxs,0,0.4341529607772827,0.5384230017662048,0.5050919055938721,0.44883233308792114,0.4303186237812042
h04xy34,k2_jackal,They won some money and got some exposure but unless they back it up with some strong runs the rest of the season it probably won’t make too much of a difference past this season.,INDYCAR,1622505600,3,t3_npckl6,t3_npckl6,0,0.43643680214881897,0.5356371402740479,0.5037163496017456,0.44208085536956787,0.42940452694892883
h04xy35,umnothnxbye,"&gt;Landscaping isn't renovation

You can absolutely renovate a yard.

Renovate definition: to restore to good condition; make new or as if new again

&gt;Replacing a kitchen requires plumbing

It requires minimal plumbing if the layout stays the same. A home owner could do it.

&gt;You cannot resize a window frame without a permit

Okay? At no point have I mentioned resizing. I talked about upgrading from one pane ton two, not enlarging the size.

&gt;High voltage electrical work more than 48V requires an electrician

I very clearly stated homeowners are allowed to do MINOR electrical work. 

&gt;I don't care about your area.

I'm sorry, are you failing to comprehend where you live could have different rules and regulations than where i do?

&gt;When a man says he's not using a plumber it electrician, he gets ridiculed for being a cowboy.

I genuinely have no fucking idea what you're talking about here.",PurplePillDebate,1622505600,1,t1_h04ok6d,t3_noj7ev,0,0.4441050887107849,0.5422095060348511,0.5052837133407593,0.4441990852355957,0.43136975169181824
h04xy37,InternationalAct2966,"Google “assemlymen district of (your county)”and you should be able to find them. Once you do, click on the contact link.",Unemployment,1622505600,1,t1_h046jxz,t3_no5d52,0,0.4363441467285156,0.5416537523269653,0.5034888982772827,0.4419254660606384,0.43002453446388245
h04xy38,dmw1987,We FROOT gang are still waitin'.,VinylReleases,1622505600,1,t3_npgmzt,t3_npgmzt,0,0.44493141770362854,0.538327693939209,0.5011221170425415,0.4465848207473755,0.4269711375236511
h04xy3b,Successful_Worth8801,Why not both,juicyasians,1622505600,2,t3_npgrk3,t3_npgrk3,0,0.43808263540267944,0.536794900894165,0.49630996584892273,0.44401976466178894,0.42975667119026184
h04xy3d,BigStinkyHogan,"We all really appreciate you doing it, I love it even though I mostly do terrible lol",DragRace_Espana,1622505600,5,t1_h04xnj3,t3_npfsep,0,0.44223442673683167,0.5332372784614563,0.5028720498085022,0.446405291557312,0.4206683039665222
h04xy3f,TheOlz,Are you using an old OS?  Win7/8 has trouble with multiple partitions on 1 sd card.,RG351,1622505600,2,t3_npeole,t3_npeole,0,0.4306464195251465,0.5372411608695984,0.5103404521942139,0.44531893730163574,0.4243013262748718
h04xy3g,Potential_Scale7578,Supermoon is going to Jupiter with or without you. We’re leaving soon so get on this mf rocket ship before it’s too late 🚀🚀🚀🚀😈😈😈😤😤😤😤🔥🔥🔥🔥🔥,CryptoMoonShots,1622505600,5,t3_npg8jy,t3_npg8jy,0,0.4374358654022217,0.5371289849281311,0.5063467621803284,0.4437253475189209,0.429007351398468
h04xy3i,Orwick,A lot of states are that way. Not paying your legislators a living wage is a way to keep people that aren’t independent wealthy off the legislature.,politics,1622505600,3,t1_h04vks7,t3_npb971,0,0.4307239055633545,0.5354007482528687,0.5039013624191284,0.4369654655456543,0.43122583627700806
h04xy3j,jcoolaa,"This is a preference, no ones gonna attack you for not using them",unpopularopinion,1622505600,3,t3_npgt48,t3_npgt48,0,0.43977639079093933,0.5361989140510559,0.5050698518753052,0.4478849768638611,0.42851120233535767
h04xy3k,H8it4U,Best Monday grind ever………,couplesgonewild,1622505600,1,t3_np9ii8,t3_np9ii8,0,0.4409012198448181,0.5431383848190308,0.5028897523880005,0.4462457001209259,0.42826664447784424
h04xy3l,Gonosoi,"I thought i put the but it didn't the series it's called ""beware of the villainess""",yurimemes,1622505600,7,t1_h04xqwo,t3_npg2to,0,0.43964114785194397,0.5375059843063354,0.5037616491317749,0.4447330832481384,0.42285391688346863
h04xy3m,zlefin_actual,"It depends on the allegations, how strong the evidence is, how long it will take to investigate/resolve them, what the succession chain and temporary replacements for the position are.  Those two should be kicked out.

I'm not sure why you say ""wake up america"", half of america is already awake and doesn't put up with stuff like this from its politicians.",PoliticalOpinions,1622505600,0,t3_np0ww0,t3_np0ww0,0,0.4355347752571106,0.5391938090324402,0.5053161978721619,0.44237020611763,0.42855051159858704
h04xy3o,whatdoblindpeoplesee,"Because there certainly weren't any conservatives or Republicans who took a boat to a lake, went camping, blew up some fireworks, or daydrank while enjoying a three day weekend. Every *True American Patriot* (TM) spent the last 72 hours reciting the names of those killed in Vietnam and placing flowers at gravestones.",TheRightCantMeme,1622505600,16,t3_np92p1,t3_np92p1,0,0.43184322118759155,0.5364202260971069,0.4991616904735565,0.4433135688304901,0.432744562625885
h04xy3p,Corrado87,Pretty sure proper hand-washing won’t create a super virus. My immune system is stronger then ever with proper diet and exercise. Thank you.,alberta,1622505600,21,t1_h04xer4,t3_npeghh,0,0.4317450523376465,0.5453040599822998,0.5086055397987366,0.4446703791618347,0.4260726571083069
h04xy3q,Yussuke,This would be nice to have today,SHIBArmy,1622505600,1,t3_npdr2d,t3_npdr2d,0,0.4415823817253113,0.5358322858810425,0.5036187171936035,0.44782358407974243,0.4252997040748596
h04xy3s,TheDownUnderBunny,"Sadly that points to him not being dominant :(.  If dominance is something you need, it probably isn't going to work.",bdsm,1622505600,2,t1_h04xehw,t3_np8evd,0,0.43525776267051697,0.536321759223938,0.5074986219406128,0.44370824098587036,0.4232870936393738
h04xy3t,CamelSizedNeedle,"Agreed with everything you said above. Would also like to just add, it is often associated with (not sure if causation or correlation) excessive drinking culture, which can be very harmful in its own way.

One of my dad's stories from college was how when he was at a frat party and they had a big bonfire going (rural middle of nowhere). They ran out of wood and were quite inebriated, so they started chucking furniture from the frat house into the fire. My dad didn't stay around to find out what happened next, but it's no suprise that Greek living has since been banned there since they attended.",ApplyingToCollege,1622505600,7,t1_h048t0a,t3_npc58l,0,0.4316592216491699,0.538394033908844,0.5016036629676819,0.4463317096233368,0.43173491954803467
h04xy3v,CosmicM00se,"Stricter gun laws would perhaps prevent future assholes like this. People want even more lax open carry laws in TX. I shouldn’t have to see people carrying ARs around and wonder if they are about to start shooting. When it’s common to have over 10 mass shootings in a single American weekend, fighting for open carry is disgusting.",news,1622505600,2,t1_h02qc8u,t3_nooj0b,0,0.43155625462532043,0.5370022654533386,0.5115320086479187,0.4412233531475067,0.43271028995513916
h04xy3w,FriedPlumRecs,"We are very excited to be working with hotel shampoo for our very first release! Cassettes will be coming soon!

d4w7-b79s

sphv-wj6l

6kqs-hwfc

un8s-5wex

xazc-3s2p

46tq-c4wn

q3n9-wade

fdak-c2w3

549k-xchs

be32-jwpd

d7xa-kwbc

smcg-k4sx

srjn-gqwp

6hb4-5ltt

kcxh-ba37",Vaporwave,1622505600,4,t3_npgr43,t3_npgr43,0,0.43483003973960876,0.532715916633606,0.5058883428573608,0.4396515488624573,0.4343433678150177
h04xy3x,SWANG_INTO_TOMORROW,I hate the “woman who tries to switch sides is killed by the villain” trope so I really hope not.,BokuNoHeroAcademia,1622505600,61,t1_h04v9gx,t3_np7ca1,0,0.4298577308654785,0.5455265641212463,0.5109757781028748,0.44133415818214417,0.4283122718334198
h04xy3y,hotmail6,"Yeah I've watched it mabey three times. I'll have to look up the director. It rolled along with a good gait, had some cool style.",movies,1622505600,1,t3_np1bvn,t3_np1bvn,0,0.4365924894809723,0.5368160605430603,0.5014021992683411,0.4488282799720764,0.4213138520717621
h04xy3z,Administrative_Cow20,"Like my dad always said, “locks just keep honest people honest”.",3Dprinting,1622505600,1,t3_np9sis,t3_np9sis,0,0.42322397232055664,0.5476650595664978,0.5161463022232056,0.44079285860061646,0.4274774193763733
h04xy40,Icy-Program9727,"You think people are gonna wanna spend all that time that they got banned just to prove it to you? If rockstar can see it (and they have before) then they will ban you. Regardless of that, don’t even bother trying it if it’s not worth the risk. Otherwise do what you want man.",gtaglitches,1622505600,2,t1_h04tqqf,t3_npf1r1,0,0.438976526260376,0.538389265537262,0.5074779391288757,0.4440377354621887,0.42577478289604187
h04xy41,funnyjunk63,Weed? Like none. Dont kill the vibe. Coke? 50/50. Trippin? Mixed bag.,AskReddit,1622505600,1,t3_npgs7p,t3_npgs7p,0,0.4341017007827759,0.5456963181495667,0.5065305829048157,0.4424157440662384,0.4242245554924011
h04xy42,justintib,It's subtle...,AskReddit,1622505600,4,t1_h03ty8z,t3_np0xcu,0,0.4407901167869568,0.5366698503494263,0.49859023094177246,0.44362181425094604,0.4262882173061371
h04xy43,Longjumping-Web7035,Your backside 🙈,RealGirls,1622505600,1,t3_npfn2f,t3_npfn2f,0,0.4402589499950409,0.5346023440361023,0.5023069381713867,0.4494963586330414,0.4276870787143707
h04xy44,LorenzoApophis,"I didn't say I was thinking of any or that it was common, but you can of course find countless examples of it. [Here's an illustration from an encyclopedia of frogs seen from various angles.](https://upload.wikimedia.org/wikipedia/commons/thumb/0/01/Anoures.jpg/800px-Anoures.jpg) [Here's a page with some Albrecht Durer paintings of animals from different angles including a lion in profile, a rabbit in 3/4, a bat from the front, and even a beetle in a kind of 3/4 view from behind.](https://www.dailyartmagazine.com/images-durers-animals/)",AskAnthropology,1622505600,0,t1_h00qqjs,t3_no6z1w,0,0.42722469568252563,0.539827287197113,0.5002004504203796,0.44936397671699524,0.42392560839653015
h04xy46,B4nanaOnAStick,Thank you friend! It's @thebrandyalexander 🥰,RedditLaqueristas,1622505600,2,t1_h04puy2,t3_np90ox,0,0.4419689476490021,0.536244809627533,0.49903613328933716,0.44877466559410095,0.4260464012622833
h04xy47,WildDasia,Tunafish with Mayo and brown sugar in it,AskReddit,1622505600,1,t3_npeddd,t3_npeddd,0,0.4414299428462982,0.5401648879051208,0.4982103109359741,0.4485819935798645,0.42339450120925903
h04xy48,AllyEmmie,It might be a mod conflict? You didn’t give much information. Do you have any mods installed? Would need a full list.,Sims4,1622505600,2,t1_h04nghv,t3_npeote,0,0.4307529032230377,0.5403653979301453,0.5090136528015137,0.44238242506980896,0.4247106909751892
h04xy49,the_hoser,"It would be better to expose the functionality required by the child as methods of the parent.  Exposing the internals of one object to another makes it difficult to make changes later, since more than one class is dependent on the implementation details of a single class.",godot,1622505600,12,t3_npg5tc,t3_npg5tc,0,0.4325040578842163,0.5396496653556824,0.5042330026626587,0.441251277923584,0.4235241711139679
h04xy4a,Worth_Fill,predsednik dela dobro,Slovenia,1622505600,1,t3_noj0wv,t3_noj0wv,0,0.43661728501319885,0.5354718565940857,0.5044113397598267,0.4508392810821533,0.42039334774017334
h04xy4c,Particular-Coffee-34,I’d watch this show.,superman,1622505600,11,t3_npgs7l,t3_npgs7l,0,0.4329637289047241,0.5386685729026794,0.5134103894233704,0.44648411870002747,0.4252590835094452
h04xy4d,reppuhnw,"I would stop using microfiber in the pockets. They are notorious for compression leaks (think sponge when you squish it). Invest in bamboo, cotton, hemp (natural  fibers). We use all mama koala during the day and have a cotton prefold wrapped around a hemp doubler. Our toddler is a flooder so we have added some bamboo on top of it in the pocket, but if your child is younger than a toddler the prefold wrapped around a hemp doubler should do the trick. I hope that helps.

Our night times are BumBumBabies AI1.5 which come with bamboo cotton inserts and we just add a couple more bamboo inserts to the pockets.",clothdiaps,1622505600,2,t3_noweuq,t3_noweuq,0,0.4382847547531128,0.5413297414779663,0.5132761597633362,0.44898930191993713,0.4388347566127777
h04xy4e,thesepticactress,https://drive.google.com/folderview?id=1Nas6pJYAv1fliGpIaH7BOQeV-TrQIMQw,boburnham,1622505600,3,t1_h04tv7c,t3_npfii3,0,0.43873223662376404,0.5318082571029663,0.5055276155471802,0.4475901424884796,0.4311753213405609
h04xy4f,Talisign,"And you always find something so bad, the fandoms and hatedoms blocked it out.",TwoBestFriendsPlay,1622505600,84,t1_h04xhk0,t3_npgoi3,0,0.426249235868454,0.5376007556915283,0.5078449845314026,0.4429190158843994,0.42799100279808044
h04xy4g,PerspectiveKey366,Yes please!!,mombod,1622505600,2,t3_npgplu,t3_npgplu,0,0.4405604600906372,0.538929283618927,0.49865269660949707,0.44702351093292236,0.4259180724620819
h04xy4h,MediumToblerone,“Did. I. Stutter?”,news,1622505600,12,t1_h04xajc,t3_np9m8k,0,0.4367617964744568,0.5399938225746155,0.5096822381019592,0.44032421708106995,0.4271846413612366
h04xy4k,AgathaDD,i traded my normal golden ladybug for 18k /:,crosstradingrblx,1622505600,1,t1_h04f2cp,t3_np6xqd,0,0.43867388367652893,0.5372146368026733,0.505979061126709,0.44931459426879883,0.42747142910957336
h04xy4l,viviornit,Spend any time in subs like hapas and your sarcasm isn't far off the mark.,hapas,1622505600,8,t1_h04pax3,t3_nperap,0,0.4349248707294464,0.5362157225608826,0.5041108131408691,0.4415395259857178,0.4240540862083435
h04xy4m,guydude24,"Was out for a while and got cold. 

Still not many other outfielders I’d like on the Braves more than him.",baseball,1622505600,15,t1_h04xi1s,t3_npgjz1,0,0.4349554479122162,0.5329257845878601,0.5061529278755188,0.44645199179649353,0.4291594922542572
h04xy4n,LampshadesAndCutlery,"I’d say diorite, then",Rocks,1622505600,1,t1_h03hdgm,t3_nozgev,0,0.4387526214122772,0.538262665271759,0.5046451091766357,0.4507385790348053,0.42652976512908936
h04xy4p,smartcooki,Do you have an Objective section at the top under your name? Is the home address listed under your name in the US? That’s most important. I would also include a clear sentence in the Objective spinning it as a positive by stating that you’ve obtained international experience dealing with many cultures and bilingual ability in X languages by being a US citizen with experience studying and working abroad.,resumes,1622505600,17,t3_npav9k,t3_npav9k,0,0.431759238243103,0.5466856360435486,0.5093808770179749,0.4424299895763397,0.42217427492141724
h04xy4q,aceytahphuu,Well dairy farmers strap down and artificially inseminate their cows and then stick their fists up their asses to check for pregnancy. Does that count as fucking an animal?,SubredditDrama,1622505600,6,t1_h049cdm,t3_np92hh,1,0.42839324474334717,0.5473280549049377,0.506080150604248,0.44203001260757446,0.42904454469680786
h04xy4r,ElCrocante2077,Feliz mes del shitposter,MAAU,1622505600,37,t3_npgs6k,t3_npgs6k,0,0.4417361915111542,0.5373361110687256,0.501335620880127,0.44815129041671753,0.4268854558467865
h04xy4s,itachimadridista,"He will, we will win the next game, it’s just game 6 I’m worried about lol",lakers,1622505601,1,t1_h04wu4q,t3_nobs5m,0,0.4369484484195709,0.5370153784751892,0.5060319900512695,0.44511014223098755,0.4244830310344696
h04xy4t,chgopanth,That’s drugs in general with me^^,TheArtistStudio,1622505601,1,t3_npgf5a,t3_npgf5a,0,0.43400517106056213,0.5398663282394409,0.5091699361801147,0.44362667202949524,0.4308207333087921
h04xy4u,MrsWhorehouse,That chimp looks like a grifter,interestingasfuck,1622505601,1,t3_npc92c,t3_npc92c,0,0.4400334656238556,0.5386053323745728,0.503042459487915,0.4474260210990906,0.42415130138397217
h04xy4v,asarjip,"Had the exact same thing. Had to give the slide a slight push for the first several mags. 
I called Keltec and they confirmed the gun needs 250-300 rounds to break in",keltec,1622505601,2,t3_np84of,t3_np84of,0,0.438412606716156,0.5415725111961365,0.5065115690231323,0.4430652856826782,0.4330616593360901
h04xy4w,IAmATroyMcClure,"Idk man... Lucas is clearly the root of the issue, but even Hayden's more routine lines come out awkward as hell. Even Natalie Portman felt at least somewhat more human as Padme compared to him, and her role was about as difficult.",starterpacks,1622505601,5,t1_h04sfsr,t3_np90u8,0,0.44117939472198486,0.5398935675621033,0.5070807933807373,0.4400855004787445,0.42300862073898315
h04xy4x,CasaDeLasMuertos,I'm sure they're super bummed that their RAPIST killed herself. We all know how much rape victims care aboput their rapists.,byebyejob,1622505601,-13,t1_h04v1ah,t3_npa24i,0,0.4356151521205902,0.539046049118042,0.5096368193626404,0.4459896981716156,0.4303203523159027
