id,author,body,subreddit,created_utc,score,parent_id,link_id,controversiality,openness,conscientiousness,extraversion,agreeableness,neuroticism
h04xy78,OfficerDBC,"That's not hypocrisy..

They just do whatever they can to get more money.",memes,1622505601,0,t1_h04nech,t3_npb61j,0,0.4314388930797577,0.5437918305397034,0.5040928721427917,0.438564270734787,0.42813795804977417
h04xy79,maxdoom5,3XXX here. Just convinced the wife to invest 10k and buy a ticket to the moon. Leave NO ape behind,amcstock,1622505601,36,t1_h04pb7k,t3_npey0s,0,0.4393579959869385,0.5371927618980408,0.5041035413742065,0.44733861088752747,0.4300916790962219
h04xy7a,TheProfessaur,"Ostensibly it means you will be paying a premium to be an informed buyer.  

I see the problem with his language but he's not entirely wrong.   

Shame ED would do this.",hoggit,1622505602,-1,t1_h04hhb8,t3_npbnaf,1,0.43586477637290955,0.5393856763839722,0.5079089403152466,0.4437578320503235,0.42407113313674927
h04xy7b,-greenergrass-,Very cool! I also like to keep one aside just to see what I can do. Aiming to make a spiral plant similar to a boxwood,microgrowery,1622505602,9,t3_npg200,t3_npg200,0,0.4313217103481293,0.5492423176765442,0.5071829557418823,0.44256117939949036,0.42535942792892456
h04xy7c,fantasychica37,"I just don't remember the meme being widespread - like nowadays we have internet articles about certain  memes, or everyone knows about certain memes, and I don't remember that with ""binders full of women"". And I wasn't confused, I think it's hilarious, because if the meme isn't well known, that means Commander Lawrence looks at memes in his spare time!",TheHandmaidsTale,1622505602,-15,t1_h04wq14,t3_np68uq,0,0.4347118139266968,0.5362333059310913,0.5016833543777466,0.43706783652305603,0.42507368326187134
h04xy7d,pontymython27,"There's an H-Mart in Riverdale and a Nam Dae Mun in Morrow. There's also a decent smaller Asian market in PTC I've stopped at before called J-Mart, but no idea if they would have that.",Atlanta,1622505602,3,t3_np981m,t3_np981m,0,0.43568873405456543,0.5415785312652588,0.5107499957084656,0.44266238808631897,0.42876479029655457
h04xy7e,No-Cardiologist725,"Fiquei a saber que Oporto também está correto em inglês, e é até a forma mais antiga de se referirem à cidade 😆

Segundo ouvi dum historiador da nossa praça(já não me lembro o nome do homem) a forma ""Oporto"" era a mais utilizada em inglês à 100/200 atrás, está comprovando em correspondências e documentos da época, apenas ""Porto"" é a forma mais utilizada recentemente. ""Oporto"" ainda é utilizado no espanhol.",portugal,1622505602,3,t1_h04o48h,t3_np430v,0,0.43520957231521606,0.5384202599525452,0.5156275629997253,0.4493303596973419,0.4140847325325012
h04xy7f,youmightbeinterested,All of them.,AskReddit,1622505602,4,t1_h04d78i,t3_np51d9,0,0.4278434216976166,0.5421661734580994,0.5056832432746887,0.4449007511138916,0.42978107929229736
h04xy7g,Snoopy769,www.ruffwear.com,DobermanPinscher,1622505602,4,t1_h04w6z7,t3_npcze7,0,0.439812034368515,0.5327109694480896,0.5052186250686646,0.4499813914299011,0.431212455034256
h04xy7i,TheOtherGuttersnipe,Guess what. I have syphilis,trashy,1622505602,7,t1_h048pdz,t3_np4oqq,0,0.4428236186504364,0.539127767086029,0.503676176071167,0.4519677460193634,0.4288622736930847
h04xy7k,Dankykang4,Thanks homie,huntersbell,1622505602,2,t1_h04xvu9,t3_npgn7l,0,0.4426744878292084,0.5394353866577148,0.4999260902404785,0.44950729608535767,0.42748045921325684
h04xy7l,MrPulsar_Original,"Did you deserve it? If not, was it an accident?",AMA,1622505602,1,t3_np1ptv,t3_np1ptv,0,0.4369639754295349,0.53978031873703,0.5029470324516296,0.4441908299922943,0.4262000620365143
h04xy7n,Dibbu_mange,Josh Hawley irl,neoliberal,1622505602,4,t1_h04xqd9,t3_nox6gz,0,0.4428192377090454,0.5415432453155518,0.5061925053596497,0.4449337422847748,0.43058696389198303
h04xy7o,vv424,"It’s not wolf its blazer aluminum and that’s all they had at my range I just wanted to test if it was ammo causing my problems ,I’ve put federal American eagle white box Winchester ,Sierra hollow points and critical defense rounds and plenty others through it ,but one out of every 20-30 so round will nosedive ,not necessarily jamming but the bullet will press against the feed ramp and get stuck there like pictured and won’t feed properly",glock43,1622505602,4,t1_h04sjxu,t3_npfoie,0,0.4406772553920746,0.5381608605384827,0.5044103264808655,0.4357723891735077,0.4332200586795807
h04xy7p,Fournote,"I guess. I don't do it with royalty or nobility either. Hereditary rule and divine right are stupid concepts IMO. I hate the idea that a bunch of arbitrary ""because we say so"" guidelines somehow make some people better than others. But I'm a bit of an anarcho-socialist so that's probably rubbing off on my attitudes toward these types of authority figures.",excatholic,1622505602,4,t1_h04wpmc,t3_nok5k4,0,0.4294270873069763,0.5411843061447144,0.5003032684326172,0.4388161897659302,0.4247451424598694
h04xy7q,jcsar_,Can anyone shoot me the link for the full video? Thank you in advance.,JordanPeterson,1622505602,1,t3_noxv1j,t3_noxv1j,0,0.4346596598625183,0.537889838218689,0.5064023733139038,0.4490642249584198,0.4248958230018616
h04xy7s,Dowsing-rods,Timothee chalamet but he grew up in the Midwest and really likes western wear.,redscarepod,1622505602,1,t3_npe14z,t3_npe14z,0,0.4340799152851105,0.5365631580352783,0.5035591721534729,0.4450652599334717,0.4214884340763092
h04xy7t,LoadPrimary4091,So fucking sexy,RosieLewis,1622505602,5,t3_np8sph,t3_np8sph,0,0.4433360695838928,0.5380018949508667,0.5030664801597595,0.4489072561264038,0.4265286922454834
h04xy7v,Saemika,Dang. TIL.,vegan,1622505602,4,t1_h04xqih,t3_np7vbx,0,0.4452955722808838,0.5371503233909607,0.5025051236152649,0.4453701972961426,0.42930707335472107
h04xy7w,racerx215,You look awesome 👏,normalnudes,1622505602,1,t3_npe0ap,t3_npe0ap,0,0.44424015283584595,0.5396322011947632,0.5015159249305725,0.449909508228302,0.4274108409881592
h04xy7y,RosieEmily,Straight out of Robin Hood Men in Tights.,freefolk,1622505602,12,t1_h03o3zs,t3_np4xnc,0,0.4318791329860687,0.5402944684028625,0.5023332834243774,0.4464742839336395,0.4305712580680847
h04xy80,bluecontrast16,"Yeah it is he discriminated against bud light

/s because humans",BlackPeopleTwitter,1622505602,8,t1_h04pa73,t3_npc4lx,0,0.44279879331588745,0.5378966927528381,0.5065911412239075,0.44350218772888184,0.4327875077724457
h04xy83,d_j_smith,"They haven't stopped the tide of prosecutions to come. Sedition is a real crime and some of them (including their beloved leader) are fully implicated in the Jan 6 insurrection. Michael Flinn just stepped over the line advocating a coup against our government. He may end up first in court now but the others will surely follow.

They can try to litigate this with propaganda but their influence is fading. As they trickle through the justice system the truth will become apparent to all but the most fanatical. Their brand of fear and hate is not what America is about. I truly believe justice will prevail in the end.",politics,1622505602,7,t1_h04801t,t3_npbh4s,0,0.43180692195892334,0.5431805849075317,0.5028405785560608,0.4423885941505432,0.42860957980155945
h04xy84,Calcutta637,Like I said hoopers hoop,sixers,1622505602,4,t3_npeihe,t3_npeihe,0,0.4408050775527954,0.5394488573074341,0.5012019872665405,0.44851306080818176,0.4285285174846649
h04xy85,3FootDuck,They meant it in a good way,AntifascistsofReddit,1622505602,3,t1_h04rg5r,t3_np0z3x,0,0.44111916422843933,0.5366378426551819,0.49959638714790344,0.44812721014022827,0.42844849824905396
h04xy86,Sangi17,They should dedicate a whole subreddit to moms posting shit about their 3-6 years olds that definitely never happened.,MadeMeSmile,1622505602,1,t3_np6qg5,t3_np6qg5,0,0.43284228444099426,0.5377663969993591,0.5149164795875549,0.44423869252204895,0.4343476891517639
h04xy88,throwaway007676,"That makes it even worse,it has to be flushed out of there. The HOAT coolant mixed with the OAT universal coolant turns the silicates into a peanut butter like substance that clogs everything.",mechanics,1622505602,5,t1_h04wzrq,t3_npc98i,0,0.43302983045578003,0.540660560131073,0.5020706653594971,0.44703927636146545,0.43133896589279175
h04xy89,Awkward_Extrovert_89,"So I guess thay dudes name is Roger, right??? 😐",PublicFreakout,1622505602,2,t3_np2qgg,t3_np2qgg,0,0.44082680344581604,0.5385343432426453,0.4918283224105835,0.44575029611587524,0.4284450113773346
h04xy8a,RedditAimFire,"Protip, depending on how long you’re going to have the drains in. Swap them over to a fanny pack instead of hanging around your neck it’ll get annoying being there I bet!",Reduction,1622505602,2,t3_noqcu4,t3_noqcu4,0,0.4422195255756378,0.5326413512229919,0.5079834461212158,0.4438135623931885,0.42741629481315613
h04xy8d,LovecraftFanatic666,"Imagine if, after y'alls fight, he spawns randomly in levels as an invader and even assists certain bosses! The horror!",darksouls3,1622505602,2,t3_npe3co,t3_npe3co,0,0.44337204098701477,0.539333701133728,0.5068022012710571,0.4416584074497223,0.42544400691986084
h04xy8e,chickenchingchong,As a former Uber Eats Doordash driver I support this message,LateStageCapitalism,1622505602,1,t3_npdnqn,t3_npdnqn,0,0.4408862292766571,0.5389432311058044,0.5069146752357483,0.4485582411289215,0.4281458258628845
h04xy8f,Genericpenisacc,Is it love? Or just a desire to get fucked?,gonewildcurvy,1622505602,2,t3_npgs7t,t3_npgs7t,0,0.4379971921443939,0.5433902144432068,0.5038156509399414,0.4433884620666504,0.42637744545936584
h04xy8g,Marx0r,"His farm just happens to be right where multiple migratory patterns intersect, so he can nab birds at the critical point of their cycle. It's not scalable and can't possibly replace the global demand for foie.

This is also not to mention that his 'foie' doesn't hit the fat content to be legally called foie in most places.",TopChef,1622505602,5,t1_h01vat7,t3_nopqyl,0,0.43939363956451416,0.5431327819824219,0.4996621608734131,0.4447879493236542,0.426554799079895
h04xy8h,grilled_cheese_sand,I unironically think its either gay cum or some kind of drug,teenagers,1622505602,1,t3_npghct,t3_npghct,0,0.44287359714508057,0.5349242091178894,0.501431405544281,0.44923296570777893,0.43258050084114075
h04xy8j,This-is-not-eric,"That's pretty bloody beautiful work by those two coppas! It's amazing how much a ""small"" gesture like that can mean to someone struggling, too.",MadeMeSmile,1622505602,6,t3_npf01r,t3_npf01r,0,0.4294682443141937,0.533973753452301,0.502349853515625,0.44077107310295105,0.4224693775177002
h04xy8k,Samantha_gold,Ahhh...te re entiendo. A mí me pasa lo mismo XD ty por responder,preguntaleareddit,1622505602,2,t1_h04urbc,t3_np8zw8,0,0.44628477096557617,0.5343277454376221,0.5040574073791504,0.4492446184158325,0.4295044243335724
h04xy8l,I_Fap_To_Murder,the reason why I suggest kyf is because something like this would could be really frustrating as a main game mode and furthermore would be even harder to balance than the sole game mode.,deadbydaylight,1622505602,1,t1_h04w9ww,t3_npgbfm,0,0.4285455346107483,0.5349161028862,0.5093585252761841,0.4423902928829193,0.41948938369750977
h04xy8m,SPGKQtdV7Vjv7yhzZzj4,I’m pleasantly surprised that a blue-sign politician is willing to risk angering the boot-aficionado crowd by asking them to at least pretend to respect the people they feel need controlling.,Lethbridge,1622505602,4,t1_h03tif7,t3_np3y25,0,0.43006765842437744,0.5384759902954102,0.5061429142951965,0.43476471304893494,0.42433005571365356
h04xy8n,treykirbz,"It didn’t show my gamer tag actually, it showed my full name and email lol",battlestations,1622505602,1,t1_h04u9my,t3_npfsib,0,0.4410730004310608,0.5320497155189514,0.4999852180480957,0.4484275281429291,0.42884501814842224
h04xy8o,EnchantedBirdie,"Hey! I appreciate the nice discussion and hitting alot of the major topics, and thanks for the compliment on the tutorial improvements I definitely think that was the best thing I added into the post, and it's the only real 100% positive change.  


I'd like to hit a few of your counter points where I think I was perhaps a little unclear and so you may have misunderstood what I meant.  


Firstly, I do fully recognize that my experience with players is completely personal but I would like to give myself some credit in that it is nearly 4000 hours of personal experience in ranked alone, and these sentiments are held by many of my friends who also play the game. So yes it is not representative of every person's experience but I do think it is certainly a large enough sample pool across enough ranks to make it decently relatable.  


Secondly, my use of the term trolling here isn't relating to just bad players or people who would often be labeled as trolls when they actually just kinda suck. I am using that as general shorthand for the players who steal roles out of anger, sell their build mid game for full MS etc etc. The people are very clearly doing shitty things and making sly remarks about it in chat and all that shit.  


Thirdly, and this is where I think you misunderstand me the most. I do not think anyone in the ranked scene is comparable to an SPL player rn (excluding ex spl players ofc) but I DO think there are many people in the SCC who are. High end SCC players, with time to practice and compete in the same league could 100% compete in the SPL, while extremely the highest tier ranked players who compete in the amateur league could totally fill the spots of low end SCC teams, which would then open up spots for more ranked players to join the amateur league and practice playing as a team. So it's of course just a cycle of good players moving up and making a larger, more interesting League.   


Finally while I agree that it would be foolish to assume Smite/TitanForge/Hirez did no market research but it's also a bit foolish to ignore the very much less than stellar history for the business side of the company. They are not exactly marketing geniuses so criticism is very much needed to keep them lined up I think.",Smite,1622505602,2,t1_h034f0a,t3_np1bro,0,0.43581661581993103,0.5357138514518738,0.5089579820632935,0.4438363015651703,0.426051527261734
h04xy8p,Idontknowmuch,"&gt;  400 years.

Much older if you count those from northwest of Iran (which not sure if technically they are a diaspora?):

&gt; The Armenian people are amongst the native ethnic groups of northwestern Iran (known as Iranian Azerbaijan), having millennia-long recorded history there while the region (or parts of it) have had made up part of historical Armenia numerous times in history. These historical Armenian regions that nowadays include Iranian Azerbaijan are Nor Shirakan, Vaspurakan, and Paytakaran. Many of the oldest Armenian chapels, monasteries and churches in the world are located within this region of Iran.

The https://en.wikipedia.org/wiki/Monastery_of_Saint_Thaddeus seems to have components from the 7th century while as per the wiki legend says it is 2 millennia old.


https://en.wikipedia.org/wiki/List_of_Armenian_churches_in_Iran#Northern_Iran",armenia,1622505602,12,t1_h04whia,t3_npgbj0,0,0.43412303924560547,0.5347329378128052,0.5019460916519165,0.4378524422645569,0.43076249957084656
h04xy8q,Venus_Val_Uptuous,I ordered a marlin 5 - there are a lot of forest trails where I live but I wanted something good on pavement too,bikeinottawa,1622505602,1,t1_h04tw36,t3_nokqgv,0,0.44237589836120605,0.5375362634658813,0.502382755279541,0.4431290328502655,0.4286782443523407
h04xy8r,Grumpybugger1,"This is a bit pathetic, don't you think?",AskReddit,1622505602,2,t3_npgm7x,t3_npgm7x,0,0.44205960631370544,0.5399664044380188,0.4971906244754791,0.4443233609199524,0.42426082491874695
h04xy8s,struggleingwithnames,"Zu einer modernen Demokratie gehört, dass eine Frau sich auf das Niveau einer Frau des 11. Jahrhunderts begeben darf, solange es ihre Entscheidung ist und nicht die Freiheit anderer oder das System der Demokratie und anderen Werten untergräbt.",ich_iel,1622505602,1,t1_h01w2f6,t3_nofkxu,0,0.429883748292923,0.5377591252326965,0.5066552758216858,0.44302690029144287,0.4165817201137543
h04xy8t,VioletDaisy95,Don’t bully someone for years on end and then expect a favour.,AmItheAsshole,1622505602,1,t3_np971l,t3_np971l,0,0.4349771738052368,0.5427907705307007,0.506549596786499,0.44403311610221863,0.4267445504665375
h04xy8u,Alconos,They’re comin to enlighten dat ass,AskReddit,1622505602,1,t1_h020lji,t3_nosug2,0,0.44093674421310425,0.5371589064598083,0.5072715878486633,0.442292183637619,0.4291461706161499
h04xy8w,Flat_Draft_8084,Residents of predominantly Black areas do often get charged higher insurance rates. The companies claim those zip codes have higher risk. Even when it’s not true. https://www.propublica.org/article/minority-neighborhoods-higher-car-insurance-premiums-white-areas-same-risk/,unpopularopinion,1622505602,3,t1_h04tb87,t3_npd05t,0,0.4327221214771271,0.5446451306343079,0.5079561471939087,0.43820810317993164,0.43316859006881714
h04xy8x,poopoojohns,"I don't allow these sorts of things in my game. I can't stand this kind of *zany* shit.


It's goofy and very selfish. It adds nothing to the game, it makes it extremely difficult for the other plays to play around and it makes it almost impossible for the DM to write and make things that are ""fair"".

I make sure to state that sort of thing is unacceptable in any session 0.


A lot of players (especially ones that aren't very experienced) come out of the game with these wild ideas of these crazy characters they want to play. I've done it before. 

But they are difficult to plan around, some of their made up character rules don't make much sense or are difficult to balance or they want some rick and morty bullshit.

I'm against that sort of thing. I generally find it best if your character starts out bland. A youngling, a nobody, some bland dude. Their character story is in the game, at the table, not before.",DMAcademy,1622505602,1,t3_novq81,t3_novq81,0,0.44248273968696594,0.5366602540016174,0.5030057430267334,0.43943944573402405,0.43133029341697693
h04xy8y,dankbrownies,FOH you fair weather dork. Redditor for 2 months lol.,conspiracy,1622505602,1,t1_h04w8oz,t3_npa7m4,0,0.4321818947792053,0.5393525958061218,0.5053348541259766,0.44779881834983826,0.4234406054019928
h04xy90,fsocietyfwallstreet,Does it bother anyone else that the sign aint level?,Superstonk,1622505602,3,t3_npaljn,t3_npaljn,0,0.4421428442001343,0.5416045784950256,0.5017613768577576,0.43808525800704956,0.42703816294670105
h04xy91,myerbot5000,"You're confusing concepts.   


Tolerance means they get to live their lives without being discriminated against or facing hostility. Acceptance means their behavior is, well, acceptable. It means that the church has to toss aside their teachings, that the Christian baker has to bake the gay wedding cake. It means that their behavior is as preferable as the traditional standard.   


Acceptance and normalization are the same, but tolerance does not mean acceptance.",SocialJusticeInAction,1622505602,6,t1_h04vwnj,t3_npd2ui,0,0.43392524123191833,0.5452141165733337,0.5008252263069153,0.4348963499069214,0.42736995220184326
h04xy92,Fa1coF1ght,*The IO wants to know Bunker Jonesy' Location*,FortNiteBR,1622505602,7,t1_h03rbk9,t3_np3b4c,0,0.44637712836265564,0.5359745025634766,0.4983223080635071,0.44456908106803894,0.42580607533454895
h04xy93,Berzercurmudgeon,"You could try throwing rocks at them, but make sure to leave no tern unstoned.",baseball,1622505602,110,t3_npgpco,t3_npgpco,0,0.4304879605770111,0.541496753692627,0.502921998500824,0.43980294466018677,0.4262787401676178
h04xy94,overweightmidget97,Nah I mean they look weird like edited I've had horses the ears are not.like that those are like donkey ears,interestingasfuck,1622505602,1,t1_h04wg1w,t3_np58zc,0,0.4375750720500946,0.5330150127410889,0.5004909038543701,0.44325804710388184,0.4273682236671448
h04xy95,YveisGrey,It doesn’t,PurplePillDebate,1622505602,1,t1_h04lrci,t3_nok7fl,0,0.44335460662841797,0.5400093197822571,0.5074952244758606,0.44403401017189026,0.429006963968277
h04xy96,TheBiggestNose,I don't think so. I believe that Nintendo has realised they have a huge library of games they can remake/remaster to current console and that being able to play these games on current console would make that much less profitable,nintendo,1622505602,0,t3_np69nc,t3_np69nc,0,0.43206456303596497,0.5344682335853577,0.506687343120575,0.4413217604160309,0.43282002210617065
h04xy97,Koala_Lover_Give_Me,In another post we almost started an arguement cause the poll had more wins when the person traded a flamingo for a pink cat,AdoptMeRBX,1622505602,1,t1_h043h7a,t3_nobcw7,0,0.44203612208366394,0.5378448367118835,0.5039886832237244,0.4455500543117523,0.4285854697227478
h04xy99,based_bhau,"&gt;String isn't biased



Bruh if he had the chance he would suck modi's dick 24/7 . 

That dude is an extremist and his only defence of Modi government is ""Congress did this back in the day too"" 
.  He  expose nothing says the same shit as white supremacist ( George Soros) 🤣🤣.
On the other hand have you watched dhruv he has raised Modi on some issues and isn't extremist as sasta dhanush nor does he calls anti national to someone who don't agree with him",IndianDankMemes,1622505602,8,t1_h04d7ml,t3_np6rb6,0,0.44373640418052673,0.5332421660423279,0.5030528903007507,0.44091179966926575,0.4252282977104187
h04xy9a,ChunkyArsenio,"&gt;  **No Paywall:**

https://archive.fo/3MedD",Conservative,1622505602,3,t3_npgu0b,t3_npgu0b,0,0.43742647767066956,0.5293009281158447,0.5077003240585327,0.4413583278656006,0.42834267020225525
h04xy9c,Beanbagchair37,If I’m still on Reddit in 50 years I’d imagine I’ll eventually see a post about a person who found this while re-flooring,funny,1622505602,1,t3_npakcw,t3_npakcw,0,0.43908563256263733,0.5356058478355408,0.510382354259491,0.4486958086490631,0.4288153648376465
h04xy9e,TheRavenSayeth,"Wow, very canny.",blursedimages,1622505602,2,t3_npcnkj,t3_npcnkj,0,0.4304332137107849,0.5406156778335571,0.5009920001029968,0.4488072991371155,0.42339661717414856
h04xy9g,DSaive,He won't address the lack of intimacy and refuses to cut contact. What is the point of counseling at this point?,Infidelity,1622505602,8,t3_npex5v,t3_npex5v,0,0.4412323534488678,0.5472604036331177,0.5078080296516418,0.4440962076187134,0.4248203635215759
h04xy9h,UwU_Gamerz,yep. feels gud,MobileLegendsGame,1622505602,3,t1_h04vusw,t3_npdtd7,0,0.4424426257610321,0.5352293848991394,0.5027102828025818,0.44483983516693115,0.4282256066799164
h04xy9i,Clazer1,"With everything you’ve mentioned, 10-13k. Rust, body, paint is expensive and it’s a non original car. So in aspect, that’s the price point I’d give. What’s he asking?",240Z,1622505602,7,t3_npg3ui,t3_npg3ui,0,0.4383697807788849,0.5415197610855103,0.5059868097305298,0.44185033440589905,0.4243525564670563
h04xy9j,Hour_Friendship_9702,Thanks. Slippin’,community,1622505602,1,t1_h020jzu,t3_noly2c,0,0.44009560346603394,0.5393096208572388,0.506458044052124,0.44416940212249756,0.4254094362258911
h04xy9k,mrolf9999999,“OUS OUS OUS”,fightporn,1622505602,7,t1_gzxcnjj,t3_nnx5ic,0,0.4456372559070587,0.5370396971702576,0.50644451379776,0.44032570719718933,0.42946112155914307
h04xy9l,TheSyrupDrinker," Johnny Papalia and Pat Musitano were made in Buffalo as well as some Luppinos.

&gt;are you Canadian

I am",Mafia,1622505602,1,t1_h04xivk,t3_np75c7,0,0.4426107108592987,0.5361931920051575,0.4995674192905426,0.4468790590763092,0.4302188754081726
h04xy9o,Tamagotchi41,"I rarely watch IndyCar because if this. I live in the states and I can't stand Indy coverage. I want to enjoy it so much but they make it so hard. 

Might also just be my preference to F1 but the announcers drive me nuts, they are all over the place with there conversations and tracking of drivers.

I'm from the states but got into F1 before Indy so I guess I've been spoiled.",formula1,1622505602,1,t3_npbv1m,t3_npbv1m,0,0.43705809116363525,0.5365221500396729,0.5074893236160278,0.4422209560871124,0.42618700861930847
h04xy9q,Mission_Busy,"Bruh imagine trying to live without alcohol 

Cringe",dankmemes,1622505602,1,t3_np6mm2,t3_np6mm2,0,0.43849319219589233,0.5342371463775635,0.5029956698417664,0.4470684826374054,0.43322035670280457
h04xy9r,Chemfreak,"100% disagree. If you mean we will run out of tokens (cents or dollars) bitcoin is potentially infinitely divisible.

If you are saying that because of the keynesian economics theory, then I say you probably aren't versed in the history of bitcoin. The biggest reason bitcoin was created, and especially having a cap, is because it was supposed to be a system that fought those exact reasons. I believe keynesian economics, especially relating to inflation is flawed at its core.",CryptoCurrency,1622505602,2,t1_h04w3ay,t3_noztp7,0,0.4311557710170746,0.5461321473121643,0.5064176321029663,0.4479600787162781,0.4309539496898651
h04xy9s,LocoRenegade,Gears 2 had the really tear popping scene with Dom.,XboxSeriesX,1622505602,4,t1_h04ctye,t3_np7szf,0,0.4385417103767395,0.538867712020874,0.5076853632926941,0.4462582767009735,0.42675697803497314
h04xy9t,Money_Nvr_Sleeps_,To me the best in the lot is the Glenfarclas!,whiskey,1622505602,2,t3_np9m12,t3_np9m12,0,0.4428624212741852,0.5364096760749817,0.5021436810493469,0.44407203793525696,0.4261617064476013
h04xy9u,ParticularStage1623,Oh you know my brother! He worked at milfy's,FridayNightFunkin,1622505602,2,t1_h035avz,t3_nozjwl,0,0.43808048963546753,0.5370148420333862,0.504819393157959,0.44717973470687866,0.42753297090530396
h04xy9v,MGUZM02,"Yea fs! Easy to apply, and keeps it slick👍",mazda3,1622505602,2,t1_h04xszp,t3_np7nfi,0,0.43615806102752686,0.5377246737480164,0.5009626150131226,0.4451119303703308,0.4284485876560211
